,show_id,type,title,director,cast,country,date_added,release_year,rating,duration,listed_in,description
2324,s2325,TV Show,He-Man and the Masters of the Universe,,,,"December 21, 2018",1983,TV-Y7,2 Seasons,"Action, Adventure, Family","In this successful all time classic series, He-man the action adventure hero, must use his superhuman power to overcome the forces of evil. It all begins when The Sorceress, who dwells in the mysterious and magical Castle Grayskull calls on Adam, Prince of Eternia. She presents Adam with a powerful and magical sword, which he must learn to use with great wisdom and knowledge. The sword enables Adam to transform himself into He-man, the most powerful man in the Universe, by holding aloft his magic sword and commanding “By the power of Grayskull! I have the power!” The sword also transforms his trusted but fearful feline friend Cringer, into the fierce and loyal sidekick, Battlecat. Together He-man and Battle-Cat become the protectors of Eternia, alongside their trusted allies and friends, Teela, Man-At-Arms and Orko. All are fighting against the evil warrior Skeletor and his army of wicked henchmen - Beastman, Trap-Jaw, Evil-Lyn, Mer-man, Tri-Klops, Whiplash, Clawful, Two-Badd, Stinkor and Webstor. Skeletor has one plan, to dissolve the empire into chaos and rule over the planet. Only one man can stop him! He-man, guided by the Scorceress, stands in Skeletor’s way but can he save the planet!"
2325,s2326,Movie,Hearts Beat Loud,,,United States,"December 19, 2018",2018,PG-13,97 min,"Comedy, Drama, Music","In Red Hook, Brooklyn, a father and daughter become an unlikely songwriting duo in the last summer before she leaves for college."
2330,s2331,TV Show,White Collar,,,United States,"December 17, 2018",2009,TV-PG,6 Seasons,"Crime, Drama","White Collar is about the unlikely partnership of a con artist and an FBI agent who have been playing cat and mouse for years. Neal Caffrey (Matt Bomer), a charming criminal mastermind, is finally caught by his nemesis, FBI Agent Peter Burke (Tim DeKay.)"
2337,s2338,TV Show,Adventure Time,,,"United States, South Korea","December 3, 2018",2010,TV-PG,10 Seasons,"Adventure, Cartoons, Family","It's one crazy adventure after another for human boy, Finn, and his best friend, Jake, a 28-year old dog with magical powers. They're out to have the most fun possible and they sure do find it exploring the Land of Ooo! Whether it's saving Princess Bubblegum, battling zombie candy, taunting the Ice King or rocking out with Marceline the Vampire Queen, with Finn and Jake it's always ADVENTURE TIME!"
2338,s2339,TV Show,The Powerpuff Girls (2016),,,,"December 2, 2018",2016,TV-PG,4 Seasons,"Action, Kids","The Powerpuff Girls centers on three sugar-coated superheroes, whose missions in life alternate between going to school, fighting crime, winning at hopscotch and saving the world before bedtime. The girls are frequently called upon by the town's childlike and naive mayor to help fight nearby criminals using their powers."
2340,s2341,Movie,Casi Leyendas,,,,"December 1, 2018",2017,TV-PG,116 min,"Comedy, International","Axel, a very peculiar Spanish man, decides to go around Buenos Aires looking for his old friends."
2349,s2350,TV Show,Nina's World,,,United States,"November 18, 2018",2015,TV-Y,2 Seasons,"Action, Adventure, Kids","Nina's World tells the story of imaginative 6-year-old Nina and best friend, Star, having everyday fun within her vibrant and colorful neighborhood. Every day transforms into a new excursion around the neighborhood - celebrating family, community, diversity and wonder."
2353,s2354,Movie,Luis and the Aliens,,,"Germany, Luxembourg, Denmark, Belgium, China","November 15, 2018",2018,PG,82 min,"Action, Adventure, Comedy","12-year-old Luis befriends a trio of awkward aliens who’ve gotten stuck on Earth after watching too much home-shopping network. With a neglectful father at home, Luis decides to escape with the aliens so he can avoid being sent away to a boarding school."
2354,s2355,TV Show,Anthony Bourdain: No Reservations,,,United States,"November 12, 2018",2005,TV-PG,2 Seasons,"Cooking & Food, Lifestyle & Culture","Anthony Bourdain uncovers the best in culinary cuisine across the world. At each location, Tony dives headfirst into life's colorful and rich pageant, bringing his intellectual curiosity, empathy, wit and boundless appetite."
2361,s2362,Movie,Johnny Reno,,,United States,"November 1, 2018",1966,TV-G,83 min,"Action, Adventure","One man stands alone against the fury of mob justice. Threats. Fists. Bullets. Fire. By one means or another, riled-up folks at Stone Junction are going to have their way."
2370,s2371,Movie,High Strung,,,"Romania, United States","October 15, 2018",2016,PG,96 min,"Drama, Music","When a Midwest dancer and a street-wise British musician meet in New York, they immediately clash but there’s an undeniable attraction as well. The two must navigate their differences for a competition that will change their lives forever."
2372,s2373,TV Show,The Bernie Mac Show,,,,"October 15, 2018",2001,TV-PG,5 Seasons,"Black Stories, Comedy, Sitcom","In an unsentimental sitcom based on his life, comedian Bernie Mac plays a stand-Up comic who, with his workaholic wife Wanda, takes in his sister's three kids while she's in rehab."
2377,s2378,TV Show,Speechless,,,United States,"October 8, 2018",2016,TV-PG,3 Seasons,"Comedy, Family, Sitcom","Maya DiMeo is a mom on a mission who will do anything for her husband, Jimmy, and kids Ray, Dylan, and JJ, her eldest son with special needs."
2379,s2380,TV Show,Dot,,,"Canada, United States","October 6, 2018",2016,TV-Y,2 Seasons,"Adventure, Kids","Dot. is about an inquisitive and exuberant 8-year-old who embarks on hilarious adventures and who fearlessly sets about solving problems...problems she most likely created herself. For a girl as energetic as Dot, there’s no better way to spend the day than outside, exploring the world with her best friends, Hal, Ruby, Nev, Dev, and her best dog, Scratch. Join her as she conquers each new challenge the same way any 8-year-old would - by messing up a lot and laughing even more. This is an animated series targeted at 4-7 year olds that aims to inspire learning and creative exploration while modeling how technology can be used as a tool to enhance real world experiences."
2384,s2385,TV Show,Brothers & Sisters,,,United States,"October 2, 2018",2006,TV-PG,5 Seasons,Drama,"Family is everything in ABC's Brothers and Sisters. Just take a look at the Walkers - they lead very different lives and may seem dysfuntional, but at the root of it, they are always there for each other - whether it's a family tragedy, professional misadventure or personal triumph. Sally Fields is Nora, the strong matriarch, who taps into strength she never knew she had and discovers new ways to bring everyone together as a family."
2387,s2388,Movie,Carved,,,Canada,"October 1, 2018",2018,PG-13,5 min,Horror,"A family obsessed with the jack-o-lantern Halloween tradition, carves off more than they expected with a pumpkin of unusual quality."
2392,s2393,Movie,"Haunting, Horrifying Sounds from Beyond the Grave",,,,"October 1, 2018",2018,PG-13,6 min,Horror,A musician’s money-grab Halloween composition unleashes terror when he decides to exploit his mother’s dying moment.
2395,s2396,Movie,Lippy,,,United Kingdom,"October 1, 2018",2018,PG-13,5 min,"Drama, Horror","Two teenage friends caught shoplifting must face the wrath of an unforgiving security guard, who forces them into a strange underworld game."
2396,s2397,TV Show,Make It or Break It,,,United States,"October 1, 2018",2009,TV-PG,3 Seasons,"Drama, Teen","Make It or Break It is a relationship drama set in the high stakes world of competitive gymnastics. The series follows a group of elite teenage gymnasts as they deal with parents, boyfriends, coaches, rivalry and betrayal. Payson is the extremely focused serious gymnast. Kaylie comes from a privileged background and doesn't think the team's rules apply to her. Lauren is highly competitive and will stop at nothing to win. Newcomer Emily attracts the attention of everyone when she arrives at the gym wearing an old leotard with gymnastics moves beyond compare. Don’t miss even one episode of this exciting new ABC Family original series!"
2399,s2400,Movie,The Box,,,,"October 1, 2018",2018,PG-13,4 min,Horror,"After stumbling upon an ancient box that carries a cryptic warning, a little boy makes a grave decision and must face the consequences."
2400,s2401,Movie,The Gillymuck,,,United States,"October 1, 2018",2018,PG-13,4 min,Horror,A troop camping trip runs awry when a young girl encounters the cute and cuddly Gillymuck…and decides to bring the creature back to her campground.
2401,s2402,Movie,The Hug,,,United States,"October 1, 2018",2018,PG-13,5 min,Horror,A children’s party at a pizza arcade turns nightmarish when the birthday boy heads backstage to seek out an animatronic panda who is off duty.
2404,s2405,TV Show,The Mary Tyler Moore Show,,,United States,"October 1, 2018",1970,TV-PG,7 Seasons,"Classics, Comedy, Family","Mary Tyler Moore stars in THE MARY TYLER MOORE SHOW, one of the most realistic, well written and enduring situation comedies of all time. The supporting cast is one of the best ever ensembled for a sitcom. THE MARY TYLER MOORE SHOW is one of the most influential in television history. The show spawned more successful spinoffs (Lou Grant, Rhoda and Phyllis) than any other sitcom in history, and its creative alumni have created such shows as The Simpsons, The Cosby Show and Cheers."
2406,s2407,Movie,The Rizzle,,,"United States, Australia","October 1, 2018",2018,PG-13,4 min,Horror,"A young woman is drawn into a video on the internet of an old, ritualistic dance, and unwittingly unlocks a supernatural dillemma."
2408,s2409,TV Show,Ugly Betty,,,United States,"October 1, 2018",2006,TV-PG,4 Seasons,"Comedy, Drama, Teen","In the superficial world of high fashion, image is everything. Styles come and go, and the only constants are the super thin beauties who wear them. How can an ordinary girl from Queens possibly fit in?"
2410,s2411,Movie,Urn,,,United Kingdom,"October 1, 2018",2018,PG-13,4 min,"Drama, Horror","A woman who angrily scatters her mother’s ashes into a lake, finds it’s not so easy to throw away the past."
2411,s2412,Movie,A 2nd Chance,,,,"September 30, 2018",2014,PG,90 min,"Drama, Family, Kids",A young girl and her coach overcome adversity to make their way into the National Gymnastics Competition.
2412,s2413,TV Show,"Truth and Lies: Jonestown, Paradise Lost",,,,"September 29, 2018",2018,TV-PG,1 Season,Documentaries,"A documentary on the 40th anniversary of the largest murder-suicide in American history, when over 900 members of the Peoples Temple consumed a deadly cyanide-laced drink on the orders of leader Jim Jones; interviews with Jones' two surviving sons."
2415,s2416,Movie,Zapped,,,"Canada, United States","September 28, 2018",2014,TV-G,94 min,"Adventure, Black Stories, Comedy","Zoey, a skilled dancer and straight-A student, is having a hard time adjusting after her mom remarries. Now she lives with 3 messy & rambunctious step-brothers, a loud step-dad and an unruly dog. The boys at school seem even worse, particularly the misfits on the JV dance squad. Nothing is going right until she discovers the dog training app on her smartphone can now control boys. Zoey uses her power to command boys to behave better, but is an app really the answer to fixing her life?"
2417,s2418,TV Show,The Gifted,,,United States,"September 26, 2018",2017,TV-PG,2 Seasons,"Action, Adventure, Drama","Family adventure series THE GIFTED, from 20th Century Fox Television in association with Marvel Television, tells the story of a suburban couple whose ordinary lives are rocked by the sudden discovery that their children possess mutant powers. Forced to go on the run from a hostile government, the family joins up with an underground network of mutants and must fight to survive."
2421,s2422,TV Show,Pasión de gavilanes,,,,"September 18, 2018",2003,TV-Y,1 Season,"Drama, Latino, Romance","La historia de amor y desamor de tres hermanos que se enamoran de las tres hermanas de su familia rival, es aderezada con una buena dosis de melodrama, seducción, comedia y una banda sonora inolvidable. Cuando los hermanos Reyes se enteran que Doña Gabriela Elizondo es quien causó la muerte de su hermana, deciden infiltrarse en su casa y hacerse pasar como albañiles para seducir a sus hijas y vengarse. Sin embargo, los hermanos Reyes no cuentan con que las hermanas Elizondo se robarán sus corazones y que entre ellos nacerá un romance intenso que debe luchar contra las adversidades y el resentimiento."
2424,s2425,TV Show,Chopped Junior,,,United States,"September 13, 2018",2015,TV-G,2 Seasons,"Cooking & Food, Family, Lifestyle & Culture",Little chefs compete to make unforgettable meals from mystery ingredients.
2425,s2426,TV Show,Expedition Unknown,,,United States,"September 11, 2018",2017,TV-PG,2 Seasons,"Adventure, Family, Lifestyle & Culture","Intrigued by legendary mysteries and driven by curiosity, Josh Gates is on a mission for answers. ""Expedition Unknown"" chronicles his global adventures as he investigates iconic unsolved events, lost cities, buried treasures and other puzzling stories. Armed with a degree in archaeology, a quick wit and a thirst for action, Gates investigates recent developments before embarking on a detailed exploration. Whether he's trekking through Fiji in search of Amelia Earhart's remains or diving the deep seas of Panama to locate Captain Morgan's pirate ship, Gates' roughshod expeditions lead him one step closer to the truth."
2427,s2428,TV Show,Cake Wars,,,United States,"September 6, 2018",2015,TV-G,4 Seasons,"Cooking & Food, Family, Lifestyle & Culture",Expert bakers go toe-to-toe to see whose cake creations will earn them the grand prize.
2428,s2429,TV Show,Cupcake Wars,,,,"September 6, 2018",2010,TV-G,2 Seasons,"Cooking & Food, Family, Lifestyle & Culture","Its cupcake vs. cupcake in Food Network's tastiest competition yet! Each week on Cupcake Wars, four of the country's top cupcake bakers face off in three elimination challenges until only one decorator remains. The sweet prize: $10,000 and the opportunity to showcase their cupcakes at the winning gig."
2446,s2447,TV Show,The Thundermans,,,United States,"July 24, 2018",2013,TV-G,4 Seasons,"Comedy, Kids, Sitcom","The Thundermans are just like any other American family, but they're superheroes! Watch this super family battle some serious sibling rivalry and eventually work together to use their extraordinary powers to create an ordinary life!"
2452,s2453,TV Show,Home Town,,,United States,"July 13, 2018",2017,TV-G,1 Season,"Lifestyle & Culture, Reality","Erin and Ben Napier love their small Mississippi hometown, especially the old historical houses. Using found materials and old textiles, they're keeping the character of these classic homes but giving them modern and affordable updates. From Erin's imaginative hand sketches to Ben's custom handiwork, this couple is bringing homes back to life and making sure their small town's future is as bright as its past."
2453,s2454,TV Show,Pocket.watch JillianTubeHD Ultimate mishmash,,,United States,"July 13, 2018",2018,TV-G,1 Season,Kids,"It’s time for DIY fun with pocket.watch JillianTubeHD Ultimate mishmash! Join YouTube star JillianTubeHD and her brother, EvanTubeHD, in all of their Tube Family adventures. Watch as Jillian makes everything from delicious, homemade desserts to gold, glittery slime!"
2454,s2455,TV Show,Pocket.watch Ryan ToysReview Ultimate mishmash,,,,"July 13, 2018",2018,TV-G,1 Season,"Family, Kids","Join your favorite YouTube superstar, Ryan, and all of his Ryan's World friends – Gus the Gummy Gator, Combo Panda, and others – in all their awesome adventures! Watch as Ryan and friends explore the world through play, do fun challenges, perform kid-friendly science experiments, and so much more! Presented by pocket.watch."
2455,s2456,TV Show,Property Brothers: Buying & Selling,,,Canada,"July 13, 2018",2012,TV-G,1 Season,"Family, Lifestyle & Culture, Reality",Two brothers help homeowners buy and sell homes.
2456,s2457,TV Show,Restaurant: Impossible,,,United States,"July 13, 2018",2011,TV-G,2 Seasons,"Cooking & Food, Family, Lifestyle & Culture",Chef Robert Irvine attempts to turn around a failing family restaurant in just two days.
2462,s2463,TV Show,The Librarians,,,United States,"July 1, 2018",2014,TV-PG,4 Seasons,"Action, Adventure, Drama","Flynn Carsen (Noah Wyle: ER, Falling Skies) may appear to be an ordinary librarian working for the world-famous Metropolitan Library, but beneath the public library lies the centuries-old headquarters of scholars and adventurers who investigate the bizarre, collect dangerous artifacts and save the world from supernatural threats. This is The Library,and Flynn is The Librarian."
2466,s2467,TV Show,M*A*S*H,,,United States,"June 29, 2018",1972,TV-PG,11 Seasons,"Action, Adventure, Comedy",A fast-paced and fun-filled series relating the antics of a mobile army surgical hospital crew during the Korean war. They are basically dedicated surgeons who turn to humor as relief from the front-line operating room.
2467,s2468,Movie,Classic Wimbledon,,,,"June 28, 2018",2018,TV-G,,Sports,"From the All-England Lawn Tennis and Croquet Club in Wimbledon, England."
2468,s2469,Movie,Curious George 3: Back to the Jungle,,,United States,"June 23, 2018",2015,G,81 min,"Action, Adventure, Comedy","Launch into the adventure of a lifetime with everyone's favorite monkey in this all-new movie, Curious George 3: Back to the Jungle! When Curious George is asked to take part in a very important space mission, a little monkeying around forces him to crash-land in Africa. While a worried Man with the Yellow Hat searches for him, Curious George bravely explores the jungle and makes new animal friends along the way. Reunited at last, the two best pals have an unforgettable adventure shared with their new friends! Featuring the voice talents of John Goodman and Angela Bassett, with music by the Plain White T's, join Curious George on his fun-filled journey that the whole family will enjoy!"
2469,s2470,Movie,Jorge el Curioso 3: De regreso a la Jungla,,,,"June 23, 2018",2015,G,80 min,"Family, Kids","El juramento reciente de Ted de “cero aventuras con monos” se pone en tela de duda cuando le ofrecen una misión espacial a Jorge. El preocupado Ted busca a Jorge después de su aterrizaje forzoso en África. El viaje de Ted le permite descubrir al aventurero que lleva dentro, mientras que Jorge tiene una aventura única en la vida con su mejor amigo."
2470,s2471,TV Show,Nine for IX,,,,"June 22, 2018",2013,TV-G,1 Season,"Documentaries, Sports",Documentary series celebrating the 40th anniversary of Title IX.
2471,s2472,Movie,Breakup at a Wedding,,,United States,"June 15, 2018",2013,PG-13,85 min,"Comedy, Romance","A videographer captures an engaged couple's decision to proceed with a sham wedding after the bride calls off the ceremony and decides to break up with her partner, who secretly hopes that his surprise gift will ultimately change her mind."
2473,s2474,TV Show,Napoleon Dynamite (2012),,,United States,"June 11, 2018",2012,TV-PG,1 Season,"Adult Animation, Comedy",Quirky cult comedy about a frizzy haired high-school geek and the screwballs that surround him in a dingy small town.
2474,s2475,TV Show,"Ruff Ruff, Tweet and Dave",,,"United States, United Kingdom","June 9, 2018",2015,TV-Y,2 Seasons,"Cartoons, Kids","Ruff-Ruff is a puppy dog who's always running around sniffing out fun things to do. Tweet is a fluffy yellow bird who loves to sing ad Dave is a quirky, inventive blue panda. Together, with Hatty the Hamster, who arrives in his Spin-Again spinning top craft, they go on fun-filled adventures in fantastical lands, where they play games and make exciting discoveries!"
2480,s2481,TV Show,Doozers,,,"Canada, United States","May 25, 2018",2014,TV-Y,2 Seasons,Kids,"From The Jim Henson company comes the preschool series Doozers. Join The Pod Squad - Spike, Molly Bolt, Daisy Wheel & Flex as they DESIGN, CREATE, and INNOVATE and put their ideas into action!"
2482,s2483,Movie,Cheddar Features,,,,"May 21, 2018",2018,TV-G,,"Documentaries, News",Learn something new from these stories worth telling.
2483,s2484,Movie,Money Menu,,,,"May 21, 2018",2018,TV-G,,"Cooking & Food, Lifestyle & Culture","Try, taste, and experience the most expensive foods, drinks, products, and activities so you're ready to go full-on opulent when you make your millions."
2487,s2488,Movie,Cheddar Explains,,,,"May 16, 2018",2018,TV-G,,"Documentaries, News, Science & Technology","The best interviews with visionaries in technology, media, and entertainment"
2495,s2496,TV Show,Chiquis 'n Control,,,United States,"May 10, 2018",2012,TV-PG,1 Season,"Latino, Music, Reality",Jenni Rivera's daughter Chiquis breaks away from her family to face the world all on her own. What does life have in store for her?
2501,s2502,TV Show,The First 48,,,United States,"May 2, 2018",2004,TV-PG,6 Seasons,"Crime, Reality",The first 48 hours after a crime is committed are key in closing the case.
2502,s2503,Movie,The Hangman,,,United States,"May 1, 2018",1959,TV-G,87 min,"Action, Adventure",A marshal goes after a man wanted for murder but finds himself pitted against an entire Western town.
2503,s2504,TV Show,Teen Titans Go! en Español,,,,"April 27, 2018",2013,TV-PG,4 Seasons,"Action, Adventure, Kids","De Warner Bros. Animation, estos jóvenes titanes no tienen descanso. Lugo de preparar un emparedado o jugar videojuegos… ¡Un momento! ¿Hay ropa para lavar? (""¡Eso no!"") Luego, definitivamente lucharán contra el crimen. Quizás. No te pierdas el regreso de Robin, Starfire, Raven, Beast Boy y Cyborg, superhéroes adolescentes sin supervisión."
2516,s2517,TV Show,Flip or Flop,,,United States,"April 1, 2018",2013,TV-G,1 Season,"Family, Lifestyle & Culture, Reality",Couple Tarek and Christina flip a new property in the hopes of making a profit.
2517,s2518,TV Show,House Hunters Renovation,,,United States,"April 1, 2018",2012,TV-G,2 Seasons,"Family, Lifestyle & Culture, Reality",Potential home buyers tour three for-sale homes to choose the perfect fixer-upper.
2518,s2519,TV Show,Iron Chef America,,,,"April 1, 2018",2005,TV-G,1 Season,"Cooking & Food, Family, Lifestyle & Culture","Based upon the Japanese cult sensation, Iron Chef America carries on the legend of Kitchen Stadium and the famed ""secret ingredient."" Each week, world-class chefs battle the legendary Iron Chefs of America: Bobby Flay, Mario Batali, Masaharu Morimoto and Cat Cora. Alton Brown serves as Commentator and Mark Dacascos is Chairman."
2523,s2524,TV Show,Toddlers & Tiaras,,,,"March 23, 2018",2008,TV-G,1 Season,"Documentaries, Family, Reality","On any given weekend in a hotel ballroom somewhere in the US, you may find a group of little girls parading around on stage in heavy makeup, weighed down by heavily sequined dresses. They're there for one of the hundreds of beauty pagaents held every year."
2526,s2527,TV Show,Deadliest Catch,,,,"March 15, 2018",2014,TV-PG,1 Season,"Adventure, Documentaries, Reality","Forty-foot waves, hurricane force winds, heavy-machinery and massive icebergs are just a few reasons that no season is ever the same on the Bering Sea. Surrounded by death and injury, these brave men struggle to return alive from man’s oldest journey."
2528,s2529,TV Show,Sister Wives,,,United States,"March 15, 2018",2010,TV-PG,1 Season,Reality,"Meet the Browns, a typical big American family except for the fact that the father, Kody, is a polygamist with four wives. Get an inside look at this unconventional family as they experience the ups and downs of living a polygamist lifestyle."
2530,s2531,Movie,SC Featured,,,,"March 13, 2018",2017,TV-G,,"Documentaries, Sports",SC Featured from ESPN.
2531,s2532,TV Show,Becoming,,,,"March 12, 2018",2014,TV-G,1 Season,"Documentaries, Kids","Every kid has that moment where he/she dreams of scoring a Super Bowl winning touchdown, standing on top of the podium with a gold medal draped around his/her neck, or sinking a 3-pointer at the buzzer. Becoming features the world's greatest athletes telling their own story and how they turned their childhood aspirations into reality."
2532,s2533,TV Show,Timeless,,,United States,"March 12, 2018",2016,TV-PG,2 Seasons,"Action, Adventure, Drama",This high-octane drama follows an unlikely trio who travel through time to battle a master criminal intent on altering the fabric of human history with potentially catastrophic results.
2535,s2536,TV Show,Survivor,,,United States,"March 4, 2018",2000,TV-PG,34 Seasons,"Action, Adventure, Family",Sixteen castaways sign up to be marooned on a tropical island in the ultimate battle for survival – and a $1 million prize.
2536,s2537,Movie,30 for 30 Shorts,,,,"March 3, 2018",2014,TV-G,,"Documentaries, Sports","A collaboration between ESPN Films and Grantland.com, 30 for 30 Shorts is an Emmy-winning series of short films that showcase new and unique stories captured through the distinct take and visual style of a variety of storytellers."
2537,s2538,Movie,Indy 500,,,,"March 2, 2018",2018,TV-G,,Sports,Indianapolis 500 On Demand: Relive all of the historic moments from The Greatest Spectacle in Racing with race re-airs from the 1960s through today.
2539,s2540,Movie,Classic Boxing,,,,"February 28, 2018",2018,TV-PG,,Sports,"Sit ringside for hundreds of the most legendary bouts in the history of the sweet science, all on-demand, including Ali/Frazier II-III, Leonard/Duran III, Hagler/Hearns, Mayweather/Pacquiao, and more."
2540,s2541,Movie,ESPN Films Presents,,,,"February 27, 2018",2009,TV-G,,"Documentaries, Sports",ESPN Films produces films covering sports-related stories.
