,show_id,type,title,director,cast,country,date_added,release_year,rating,duration,listed_in,description
844,s845,TV Show,Unikitty,,,"United States, Denmark","April 1, 2021",2017,TV-Y7,3 Seasons,"Action, Adventure, Comedy","Cartoon Network is transporting viewers to a joyous kingdom full of sparkle matter, happy thoughts and the occasional rage-out in Unikitty!"
845,s846,TV Show,Vegas Chef Prizefight,,,,"April 1, 2021",2020,TV-G,1 Season,"Cooking & Food, Lifestyle & Culture, Reality","Chef Anne Burrell hosts as eight handpicked, hotshot chefs compete for the job of a lifetime – a head chef position at a new, $10 million restaurant at the Flamingo Resort and Casino in Las Vegas."
849,s850,TV Show,All of Us,,,,"March 29, 2021",2003,TV-PG,4 Seasons,"Comedy, Sitcom","Inspired by the domestic lives of celebrities Jada Pinkett Smith and Will Smith, the family comedy ""All of Us"" reflects a new generation's enlightened attitude towards those who juggle ex-spouses, dating and professional lives. Robert James, an entertainment reporter for a local Los Angeles television station, is handsome, smart and thoroughly modern in his thinking. Recently divorced from the somewhat self-absorbed Neesee, the mother of their endearing 6-year-old son, Robert refuses to buy into the old stereotype that being divorced means you can't get along with the ex."
855,s856,Movie,The Hurricane Heist,,,,"March 26, 2021",2018,PG-13,103 min,"Action, Adventure",Thieves attempt a massive heist against the U.S. Treasury as a Category 5 hurricane approaches one of its Mint facilities.
859,s860,Movie,100% Wolf,,,,"March 23, 2021",2020,TV-PG,96 min,Comedy,"Freddy Lupin can't wait to become a werewolf, just like his legendary father. But when the big day arrives, something goes awry and Freddy transforms into a ferocious…poodle."
864,s865,TV Show,Catfish: The TV Show,,,United States,"March 20, 2021",2012,TV-PG,8 Seasons,"Documentaries, Reality, Teen",Catfish: The TV Show brings together couples who've interacted solely through LCD screens. Over the course of months they've supposedly fallen in love – but what will happen when they meet in real life for the first time?
869,s870,TV Show,Holmes Family Effect,,,,"March 17, 2021",2021,TV-PG,1 Season,Lifestyle & Culture,"Contractor Mike Holmes and his children, Sherry and Michael, tackle projects and surprise deserving individuals who are making positive impacts in their communities."
901,s902,TV Show,Game of Talents,,,,"March 11, 2021",2021,TV-PG,1 Season,Reality,"Combining the awe, wonder and spectacle of a large-scale variety show with a clue-centered, high-intensity investigative game, ""Game of Talents"" is a new hybrid series. The series pits two teams of contestants against each other as they attempt to figure out the surprising – and sometimes bizarre – hidden talents of the mystery performers. With more than $200,000 on the line, it's up to the contestants to identify unique skills, including fire dancing, spider wrangling, chainsaw juggling and contortion. Wayne Brady hosts."
904,s905,TV Show,Heartland,,,,"March 10, 2021",2007,TV-PG,13 Seasons,"Drama, Family, International","Adapted from Lauren Brooke’s best-selling novels, this compelling family drama follows life on the Heartland ranch as sisters Amy and Lou, together with their grandfather Jack, deal with the challenges of running a ranch that has been in the family for generations."
909,s910,TV Show,Blossom,,,,"March 8, 2021",1991,TV-PG,5 Seasons,"Comedy, Sitcom","Fifteen-year-old Blossom Russo is the only girl in a house that includes her session musician father, her curmudgeonly grandfather and two brothers, recovering addict Anthony and jock Joey, who is a few yards short of a first down. Mom has abandoned the family to pursue a singing career in Paris, and the family attempts to adjust. Blossom is not quite a beauty, but neither a geek. She is smart and reasonably popular. She dreams of a sitcom fantasy mother, and frequently gets ‘advice’ from famous celebrities. Blossom’s best friend, Six, an especially fast talker with a tendency to ramble, plays a significant part in her life."
912,s913,Movie,Jorge Ramos y su Banda,,,,"March 8, 2021",2009,TV-G,,"Latino, Sports",Los titulares más grandes en deportes son discutidos en Jorge Ramos Y Banda.
916,s917,Movie,Storks,,,,"March 6, 2021",2016,PG,87 min,"Adventure, Cartoons, Comedy",A delivery stork cooks up trouble for himself and a pal in the form of a bouncing baby girl in this animated family hit.
930,s931,Movie,Just Married,,,,"March 1, 2021",2003,PG-13,95 min,"Comedy, Drama, Romance",Ashton Kutcher and Brittany Murphy star as two lovebirds from opposite sides of the tracks who go on the honeymoon from hell.
931,s932,TV Show,Little Baby Bum,,,,"March 1, 2021",2017,TV-Y,3 Seasons,"Family, Kids","Little Baby Bum is the home of colourful kids content for children all around the world. Fun catchy songs, lovable and engaging characters take children on a journey of learning and adventure."
932,s933,Movie,Neil Young: Heart of Gold,,,,"March 1, 2021",2006,PG,104 min,"Documentaries, Music","Filmmaker Jonathan Demme captures the rocker in concert before a live audience at Ryman Auditorium in Nashville, Tennessee."
933,s934,Movie,Priceless,,,,"March 1, 2021",2016,PG-13,99 min,"Drama, Mystery, Thriller","A widower who loses custody of his daughter finds himself unable to hold down a job. He agrees to drive a truck across the country, no questions asked. He discovers what he is delivering, he is faced with a life-changing choice."
934,s935,Movie,Florence Foster Jenkins,,,,"February 26, 2021",2016,PG-13,111 min,"Comedy, Drama, International","Meryl Streep delivers a ""hilarious and touching"" performance as a New York socialite who dreams of becoming a great opera singer. While the voice she hears in her head is beautiful, to everyone else it's awful."
942,s943,TV Show,Spring Baking Championship,,,,"February 23, 2021",2015,TV-G,1 Season,"Cooking & Food, Family, Lifestyle & Culture",Some of America's best bakers get set to prove their skills in this springtime baking championship.
947,s948,Movie,Sonic the Hedgehog,,,,"February 18, 2021",2020,PG,99 min,"Adventure, Comedy, Kids",SONIC THE HEDGEHOG tells the story of the world's speediest hedgehog as he embraces his new home on Earth. Sonic and his new best friend Tom team up to defend the planet from the evil genius Dr. Robotnik and his plans for world domination.
949,s950,TV Show,Kenan,,,,"February 17, 2021",2021,TV-PG,1 Season,"Black Stories, Comedy, Sitcom","Kenan's a local Atlanta TV personality and single father working hard to balance his career as the host of ""Wake Up With Kenan,"" a popular morning show, with raising his two spirited school-age daughters. But juggling his job and family proves difficult when his friend Mika is his tenacious producer, his brother Gary is his clueless manager, his father-in-law, Rick, is his toughest critic – and everyone who thinks they're doing their best to make his life a little easier seems to make it a whole lot harder."
950,s951,Movie,Logan Lucky,,,,"February 17, 2021",2017,PG-13,119 min,"Comedy, Crime, Drama","Trying to reverse a family curse, brothers Jimmy (Channing Tatum) and Clyde Logan (Adam Driver) set out to pull off an elaborate heist during the legendary Coca-Cola 600 auto race at Charlotte Motor Speedway."
959,s960,TV Show,Forged in Fire: Beat the Judges,,,United States,"February 15, 2021",2020,TV-PG,1 Season,Reality,"In each episode, the best bladesmiths from all over the country come to the forge for a once-in-a-lifetime opportunity, to square off against our renowned Forged in Fire Masters in the highest stakes forging competition yet!"
960,s961,TV Show,House Hunters,,,United States,"February 15, 2021",1999,TV-G,30 Seasons,"Family, Lifestyle & Culture, Reality","The pursuit of the perfect home involves big decisions. This series follows real buyers as they establish a budget, tour homes for sale, weigh pros and cons, and finally make an offer."
961,s962,TV Show,House Hunters International,,,United States,"February 15, 2021",2006,TV-G,22 Seasons,"Family, Lifestyle & Culture, Reality","This spinoff of the wildly popular HGTV House Hunters globe trots from Sao Paolo to Prague. Home hunters and their real estate agents check out all sorts of architectural styles and work through the idiosyncrasies of buying real estate in other countries. In any language, home buying is an emotional experience."
965,s966,TV Show,Pawn Stars,,,United States,"February 15, 2021",2009,TV-PG,2 Seasons,Reality,"""Pawn Stars"" follows three generations of the Harrison family as they assess the value of items coming in and out of their Gold & Silver Pawn Shop in Las Vegas, from the commonplace to the truly historic."
966,s967,TV Show,Property Brothers,,,Canada,"February 15, 2021",2011,TV-PG,6 Seasons,"Family, Lifestyle & Culture, Reality",Contractor Jonathan Scott and real estate expert Drew Scott combine their skills to help families find and buy a house to transform into their dream home.
969,s970,TV Show,The Secret of Skinwalker Ranch,,,United States,"February 15, 2021",2020,TV-PG,1 Season,"Documentaries, Science Fiction","For the first time ever, HISTORY is gaining full, unprecedented access to one of the most infamous and secretive hotspots of paranormal and UFO-related activities on earth, Skinwalker Ranch."
976,s977,Movie,Havana Street Party Presents: Beatriz Luengo,,,,"February 13, 2021",2021,TV-PG,,"Documentaries, Music, News","Spanish singer Beatriz Luengo performs hits from her latest album ""Cuerpo & Alma"" in this special show full of Cuban music and flavor."
983,s984,Movie,Then Came You,,,,"February 11, 2021",2020,PG-13,98 min,"Comedy, Romance","A lonely widow plans a trip around the world with her husband's ashes, to visit the places they loved in the movies. The first stop on the journey changes her life forever."
985,s986,TV Show,Moesha,,,United States,"February 9, 2021",1996,TV-PG,6 Seasons,"Black Stories, Comedy, Sitcom","Navigating the twists and firsts of being a teen, Moesha juggles friendships, romance and the occasional drama while trying to keep her family together."
986,s987,TV Show,"Sister, Sister",,,United States,"February 9, 2021",1994,TV-G,6 Seasons,"Black Stories, Comedy, Sitcom",Tia Landry and Tamera Campbell are twins separated at birth who learn of each other's existence and come together as teenagers.
1006,s1007,Movie,The Haunting in Connecticut,,,,"February 1, 2021",2009,PG-13,103 min,"Drama, Horror, Thriller","In this supernatural thriller, the Campbell family's move to Connecticut takes a mysteriously dark turn when a series of shocking paranormal events reveals that their inviting new home is a former mortuary with a sordid past. Based on a true story."
1009,s1010,Movie,The Undefeated,,,,"January 30, 2021",2017,TV-G,,Sports,"The Undefeated explores sports, style and culture."
1010,s1011,TV Show,Jann,,,Canada,"January 29, 2021",2019,TV-PG,2 Seasons,Comedy,"""In JANN, Jann Arden plays a fictionalized, self-deprecating version
of herself: a singer songwriter of a “certain age” in severe denial of the harsh reality that her former music career is slowly (okay rapidly) fading away. But it’s not just Jann’s career that’s on life support – she’s newly single (don’t remind her), her sister may disown her, and her mother may be showing early signs of memory loss. Jann's personal life is in shambles and she's convinced that the cure-all is to enlist a new manager to help rebrand her image. Filled with plenty of LOL moments, she embarks on a quest to return to greatness and go viral, but instead gets tangled in the pressures of her ‘real’ life. Jann is at the crossroads between who she was and who she wants to be. Can Jann stage a comeback, reclaim fame…and be there for the people who love her?"""
1012,s1013,TV Show,Mixed-ish,,,United States,"January 27, 2021",2019,TV-PG,2 Seasons,"Black Stories, Comedy, Sitcom","In this spinoff of the hit series black-ish, Rainbow Johnson recounts her experience growing up in a mixed-race family in the '80s, and the constant dilemmas they had to face over whether to assimilate or stay true to themselves. Bow's parents Paul and Alicia decide to move from a hippie commune to the suburbs to better provide for their family. As her parents struggle with the challenges of their new life, Bow and her siblings navigate a mainstream school in which they’re perceived as neither black nor white."
1015,s1016,TV Show,Freaks and Geeks,,,United States,"January 25, 2021",1999,TV-PG,1 Season,"Comedy, Drama","The universal experience of teenagehood as lived by the regular old freaks and geeks in a Michigan high school, circa 1980, is the subject of this wistful comedy-drama executive-produced by Emmy-winner Judd Apatow and series creator Paul Feig."
1019,s1020,Movie,Terra Willy: Unexplored Planet,,,France,"January 22, 2021",2019,PG,90 min,"Adventure, Comedy, Kids","When a young boy crash lands on an unexplored planet, he must rely on a survival robot and an alien creature to help him find his way home."
1024,s1025,TV Show,A Very Brady Renovation,,,United States,"January 20, 2021",2019,TV-G,1 Season,"Lifestyle & Culture, Reality","Jason Pickens visits The Brady Bunch cast members to learn what they're doing now. Then, from touring historic homes with Eve Plumb to exploring Branson, MO, with Barry Williams, he explores each cast member's passion project."
1026,s1027,TV Show,Gold Rush,,,United States,"January 20, 2021",2010,TV-PG,3 Seasons,Reality,"In the face of an economic meltdown, a group of men will risk everything to strike it rich mining for gold in the wilds of Alaska."
1028,s1029,TV Show,Property Brothers: Forever Home,,,United States,"January 20, 2021",2019,TV-G,1 Season,"Lifestyle & Culture, Reality",Drew and Jonathan Scott are on a mission to help couples transform their houses into homes where they can put down roots. The brothers unlock the full potential of each property and renovate to make dreams come true.
1030,s1031,TV Show,Rock the Block,,,United States,"January 20, 2021",2019,TV-PG,1 Season,"Lifestyle & Culture, Reality","Leanne Ford, Alison Victoria, Jasmine Roth and Mina Starsiak-Hawk each have a month to renovate a home. The designer who nets the highest appraisal gets bragging rights and a street named in her honor."
1033,s1034,TV Show,Hollyoaks,,,United Kingdom,"January 18, 2021",1995,TV-PG,2 Seasons,"Drama, International, Romance","Hollyoaks is a glossy, fast-paced and engaging drama. Featuring top class acting and witty, evocative writing; the show has constantly raised the bar for teen entertainment."
1036,s1037,TV Show,Coronation Street,,,United Kingdom,"January 15, 2021",1960,TV-PG,2 Seasons,"Drama, International","Britain's favorite drama series Coronation Street is loved by millions of fans worldwide. For five decades we have been gripped by the domestic dramas of these ordinary people on the fictional cobbled street in Manchester. The roll call of iconic characters over the years is endless, with approximately 5,000 characters. The street has seen it all, from affairs of the heart to domestic disasters. With over 7,500 episodes there have been 39 births, 120 deaths and 88 weddings."
1037,s1038,TV Show,Endlings,,,Canada,"January 15, 2021",2020,TV-PG,2 Seasons,"Action, Adventure, Family","Set 20 years in the future, Endlings is the empowering story of four teenagers in foster care who discover they're not alone in the universe, even though sometimes it can feel like they are. Halfway across the world, Tuko is alone. After the death of her mate, Tuko becomes the last elephant in existence – what biologists call an endling. Her endling status summons to Earth a mysterious Alien who is on an intergalactic quest to save the last member of near-extinct species. After Tuko is collected, the Alien's ship malfunctions and sends it on a crash course with the farm where Julia (Kamaia Fairburn), Johnny (Edison Grant), Tabby (Michela Luci) and Finn (Cale Thomas Ferrin) live with their foster dad, Mr. Leopold (Neil Crone). Before crashing, the Alien releases all of its cosmic collection into the fields and wilderness surrounding the property. This kicks off a high-action life-altering mission to retrieve these fantastical creatures before the local police, Tuko's caretaker (Oyin Oladejo), or a secretive industrialist (Lisa Ryder) can. Along the way, four discarded teens discover that ""endling"" doesn't have to mean the end; it can also mean a new beginning."
1042,s1043,TV Show,Unpolished,,,United States,"January 13, 2021",2019,TV-PG,2 Seasons,Reality,"Following the zany antics of a family-run salon on Long Island, including nail artist Lexi Martone and her sister Bria who co-own the place."
1044,s1045,TV Show,Last Man Standing,,,United States,"January 11, 2021",2011,TV-PG,9 Seasons,"Comedy, Family, Sitcom","Mike Baxter is a happily married father of three daughters who finds himself the odd man out as he tries to maintain his manliness in a home surrounded by women. Mike tries to escape all the female drama at home in the warm, manly embrace of his job at the Outdoor Man store, a sporting goods emporium where he is marketing director. He also revels in his Outdoor Man vlog, which he uses as a pulpit for his opinions – which often have nothing to do with the store's merchandise. When he's supposed to be selling mountain bikes or kayaks, he somehow ends up spouting off about the environment, health care, international politics or any other topic occupying his mind."
1045,s1046,Movie,Lights Out,,,United States,"January 11, 2021",2016,PG-13,81 min,"Horror, Thriller",A young woman and her step-brother are terrorized by a malevolent spirit that only appears when the lights go out.
1049,s1050,TV Show,WWE 205 Live,,,United States,"January 9, 2021",2016,TV-PG,6 Seasons,Sports,"The greatest performers from WWE's Cruiserweight division showcase their unparalleled abilities on WWE Network! Witness Buddy Murphy, Cedric Alexander, The Brian Kendrick, Kalisto, Gran Metalik, and many more world-class talents perform breathtaking feats of athleticism on 205 Live!"
1050,s1051,TV Show,WWE en Español,,,,"January 9, 2021",2012,TV-PG,8 Seasons,"Latino, Sports","Únete a los comentaristas de WWE en Español todas las semanas para que te enteres de las últimas noticias de Raw, Smackdown Live y mucho más , en nuestro idioma. ¡No te lo pierdas!"
1051,s1052,TV Show,Celebrity Wheel of Fortune,,,United States,"January 8, 2021",2021,TV-PG,1 Season,Game Shows,"""Celebrity Wheel of Fortune"" takes a new spin on the iconic game show ""Wheel of Fortune."" Hosted by pop culture legends Pat Sajak and Vanna White, ""Celebrity Wheel of Fortune"" welcomes celebrity contestants to spin the world's most famous wheel and solve word puzzles for a chance to win up to $1 million. All of the money won by the celebrity contestants goes to a charity of their choice."
1053,s1054,TV Show,Mr. Mayor,,,United States,"January 8, 2021",2021,TV-PG,1 Season,"Comedy, Sitcom","When retired Los Angeles businessman Neil Bremer decides to run for mayor of his beloved city, he surprises everyone and wins the seat. With great ideas and commitment to the community, he optimistically sets out to get to work shaking up City Hall. However, he quickly discovers navigating politics is not business as usual. There are opinions to be heard, ribbons to be cut and foods to be eaten – all in support of his fellow citizens. Luckily, he can rely on the know-how of his political-veteran deputy Arpi – whose savvy and ambition make her equal parts friend and foil – and the dedication of his offbeat staff to keep him on the right path, as well as some inspiration from his teenage daughter."
1055,s1056,Movie,Gretel & Hansel,,,,"January 7, 2021",2020,PG-13,87 min,"Drama, Horror, Mystery","A long time ago in a distant fairytale countryside, a young girl leads her little brother into a dark wood in desperate search of food and work, only to stumble upon a nexus of terrifying evil."
1056,s1057,TV Show,Name That Tune,,,,"January 7, 2021",2021,TV-PG,1 Season,Game Shows,"Hosted by Jane Krakowski, the beloved musical game show tests contestants' music knowledge as they battle it out in an assortment of challenging musical games for cash and prizes. Two players race against the clock to test their knowledge of songs performed by a live band with Randy Jackson as band leader. Each contest features a rotating variety of games from the original format, before the iconic bid-a-note round. The player with the most money at the end of bid-a-note wins the game and takes his or her bank into the golden medley bonus round for a chance to win additional cash, and potentially, the $100,000 grand prize."
1058,s1059,TV Show,WWE Main Event,,,United States,"January 7, 2021",2012,TV-PG,8 Seasons,Sports,"Join us each week for WWE Main Event, as the Superstars of the Monday Night RAW roster battle it out."
1059,s1060,TV Show,WWE NXT,,,United States,"January 7, 2021",2010,TV-PG,8 Seasons,Sports,The future is here. WWE’s hottest up and coming Superstars compete to prove they have what it takes.
1061,s1062,Movie,Mighty Oak,,,,"January 6, 2021",2020,PG-13,101 min,"Comedy, Drama, Music","Gina Jackson's life is shattered when her brother, Vaughn, is killed in a tragic accident. Ten years later, when a young guitar prodigy Oak Scoggins enters her orbit, she becomes convinced that this young man is the reincarnation of Vaughn, but is he?"
1064,s1065,TV Show,The Wall,,,,"January 5, 2021",2017,TV-PG,1 Season,"Family, Game Shows, Reality","From Executive Producer and NBA superstar LeBron James comes “The Wall,"" the fastest and simplest game with more than $12 million on the line every night - and up to $3 million on a single heart-stopping drop. At four stories high, the wall was built for one purpose - to change people's lives. With tremendous cash prizes waiting at the bottom, this game can change lives in an instant. Hosted by Chris Hardwick."
1066,s1067,TV Show,Call Me Kat,,,"United Kingdom, United States","January 4, 2021",2021,TV-PG,1 Season,"Comedy, Sitcom","In an effort to prove to her mother – and society – that it's possible to be single at 39 and still be happy, Kat spends her entire savings to open a cat café in Louisville, Ky."
1068,s1069,TV Show,Centennial,,,,"January 1, 2021",1978,TV-PG,1 Season,"Action, Adventure, Drama","Centennial - a 12-episode television miniseries - is based on the best-selling historical novel by Pulitzer Prize-winning author James Michener. At the time, the Centennial production was the most ambitious miniseries project ever attempted: nearly 100 speaking parts, four directors and five cinematographers, and multiple shooting locations across the USA combined to produce the massive 22-hour tale. Epic in its scope, Centennial portrays the development of the American western frontier from the late 18th century through the late 20th century, as seen through the eyes of families who eventually establish a town on the windswept plains of eastern Colorado. An all-star cast of television favorites populates this engrossing story."
1070,s1071,Movie,Diary of a Wimpy Kid,,,"United States, United Kingdom","January 1, 2021",2010,PG,93 min,"Comedy, Family, Kids",A sixth grader attempts to find his place in the gawky adolescent world of junior high in this family film.
1074,s1075,Movie,Footloose,,,United States,"January 1, 2021",1984,PG,107 min,"Classics, Drama, Music",An urban teenager who moves to a small town dominated by a fundamentalist preacher wages an ambitious war against adult repression.
1076,s1077,Movie,How Do You Know,,,United States,"January 1, 2021",2010,PG-13,121 min,"Comedy, Drama, Romance","In this love triangle comedy, a white collar executive and professional baseball player are each vying for the affections of the same woman."
1079,s1080,Movie,Shrek,,,"United States, Japan","January 1, 2021",2001,TV-PG,120 min,"Action, Adventure, Cartoons","Once upon a time, in a far away swamp, there lived an ornery ogre named Shrek whose precious solitude is suddenly shattered by an invasion of annoying fairy tale characters."
1080,s1081,Movie,Star Trek Beyond,,,,"January 1, 2021",2016,PG-13,122 min,"Action, Adventure, Family","Dispatched on a rescue mission to the farthest reaches of space, the USS Enterprise is ambushed by Krall, a ruthless enemy sworn against the Federation."
1083,s1084,Movie,The Haunting,,,,"January 1, 2021",1999,PG-13,113 min,Horror,"A professor invites three insomniacs to participate in a sleep disorder study at an eerie, isolated New England mansion. But it turns out that the professor is far more interested in the sinister mansion and its ghastly horrors."
1084,s1085,Movie,Where Hope Grows,,,United States,"January 1, 2021",2015,PG-13,98 min,"Drama, Family","A self-destructive former pro baseball player's faith in God is restored when he meets Produce, an inspirational man with Down syndrome"
1091,s1092,TV Show,The Masked Dancer,,,United States,"December 28, 2020",2020,TV-PG,1 Season,"Lifestyle & Culture, Reality","Hosted by comic Craig Robinson, with panelists Ken Jeong, Paula Abdul, Brian Austin Green and Ashley Tisdale, ""The Masked Dancer"" is a top-secret dance competition in which celebrities shake their tail feathers while covered from head to toe in elaborate costumes and face masks, leaving audiences to guess their identities. Costumed celebrities are joined on stage by masked partners and back-up dancers as they perform a series of dances together, spanning from hip-hop to salsa, jazz to tap dancing and more. When it comes to dance styles, the sky is the limit. Each week, a series of clues is sprinkled throughout packages, costumes and routines, leading the panelists one step closer to figuring out which famous faces are behind the masks."
