,show_id,type,title,director,cast,country,date_added,release_year,rating,duration,listed_in,description
5958,s5959,Movie,Duniya,Ramesh Talwar,"Ashok Kumar, Amrita Singh, Prem Chopra, Amrish Puri, Pran, Satyendra Kapoor, Mac Mohan, Javed Khan, Sulbha Deshpande, Dilip Kumar",India,,1984,ALL,170 min,"Drama, International","The story revolves around Mohan (Dilip Kumar), a genuine and conscientious man, who is falsely framed for the murder of his good friend who also happens to be his boss. The trio that killed his friend and framed him are Mohan's fellow employees. He serves his sentence and is finally released after many years and sets out for revenge by going after the ones that caused him his misery."
6607,s6608,Movie,Zabardast,Mahesh Kothare,"Pushkar Jog, Manasi Naik, Sanjay Narvekar, Makarand Anaspure, Kishori Ambiye, Priya Berde, Abhiram Bhadkamkar, Vijay Chavan, Bharat Jadhav, Siddarth Jadhav, Rasika Joshi, Mahesh Kothare, Santosh Pawar, Aditya Redij, Sanjiv Talpade, Sunil Tawde, Yohana Vachhani",India,,2007,ALL,142 min,"Arts, Entertainment, and Culture","Pushkar finds a magic coat that fulfils wishes once someone wears it. Using it, he decides to impress the girl he loves and enter a dance reality show with her. Will he win the competition?"
6644,s6645,Movie,Full 3 Dhamaal,Mahesh Kothare,"Makarand Anaspure, Prasad Oak, Priya Berde, Suchitra Bandekar, Abhiram Bhadkamkar, Kishori Godbole, Dilip Prabhavalkar, Siddarth Jadhav, Ameya Hunaswadkar, Rasika Joshi, Savita Malpekar, Kranti Redkar, Prema Sakhardande",India,,2008,ALL,111 min,Comedy,"Three friends who had plenty of fun while in college end up living bothersome lives after marriage. They are held down by family traditions and customs. When they meet again, they decide to go back to their old ways while their husbands are away."
6659,s6660,Movie,Anari,K. Muralimohana Rao,"Venkatesh Daggubati, Karisma Kapoor, Johnny Lever, Rakhee Gulzar, Suresh Oberoi, Gulshan Grover, Laxmikant Berde, Priya Arun, Beena Banerjee, Adi Irani, Shashi Kiran, Sudha Rani, Raju Shrestha, Subbiraj",India,,1993,ALL,171 min,"Comedy, Drama, Romance","A rich girl appoints a simpleton, as her bodyguard. She soon falls in love with him, which creates havoc in his life."
6887,s6888,Movie,Jatra,Kedar Shinde,"Bharat Jadhav, Siddarth Jadhav, Viju Khote, Sanjay Khapre, Priya Berde, Vijay Chavan, Upendra Limaye, Kranti Redkar, Amir Tadwalkar, Sunil Tawde, Kushal Badrike, Munir Baghman, Mohan Bagode, Vandan Bakmis, Shankar Bhake, Jaiwant Bhalekar, Dilip Budhkar, Kishore Chougule, Kamlakar Satputhe",India,,2005,ALL,138 min,Comedy,"In this comedy drama, when two villages (Hyalagaad and Tyalagaad) fight over the right to host a religious fair, they conduct a race to make a decision. But both sides are willing to do anything to win."
7416,s7417,Movie,Chashme Bahaddar,Vijay Patkar,"Sanjay Narvekar, Dipali Sayyad, Vijay Chavan, Johnny Lever, Rajpal Yadav, Deepak Shirke, Sahil Shirvaikar, Jaiwant Bhalekar, Kishori Ambiye, Purnima Ahire, Vijay Kadam, Jayraj Nair, Arun Nalawade, Sunil Pal, Nisha Parulekar, Kamlakar Satputhe, Sunil Tawde",India,,2006,ALL,146 min,Comedy,"Rajaram (Sanjay Narvekar), an ordinary librarian, finds himself standing against a powerful builder and his goons, who want to vacate the chawl in which he resides. His life changes after receiving a pair of magical eyeglasses from his step-grandpa's spirit."
8366,s8367,Movie,Aashiqui 2,Mohit Suri,"Aditya Roy Kapoor, Shraddha Kapoor, Shaad Randhawa, Salil Acharya, Chitrak Bandyopadhyay, Bugs Bhargava, Ashish Bhatt, Gagan Gupta, Shubhangi Latkar, Soumyajit Majumdar, Nickk, Milind Phatak, Shekhar Shukla, Mahesh Thakur",India,,2013,ALL,127 min,"International, Romance",Rahul loses his fans and fame due to alcoholism. But he then decides to turn a small time singer into a rising star.
8825,s8826,Movie,Sunny (4K UHD),Ranjith Sankar,Jayasurya,India,,2021,PG-13,93 min,"Drama, Suspense","The life of a failed musician, sunny takes a dramatic turn as he smuggles himself back from Dubai to Kerala in midst of a global pandemic and shuts himself from the society."
8826,s8827,Movie,Sunny,Ranjith Sankar,Jayasurya,India,,2021,PG-13,93 min,"Drama, Suspense","The life of a failed musician, sunny takes a dramatic turn as he smuggles himself back from Dubai to Kerala in midst of a global pandemic and shuts himself from the society."
