,show_id,type,title,director,cast,country,date_added,release_year,rating,duration,listed_in,description
142,s143,Movie,Wedding Cha Shinema,Saleel Kulkarni,"Shivraj Waichal, Rucha Inamdar, Mukta Barve, Purnima Ahire, Adesh Aware",India,,2019,ALL,138 min,"Comedy, International","An aspiring filmmaker reluctantly takes up the assignment of filming a wedding in a small town. Once she gets there, she is drawn into the celebration, chaos and drama surrounding the family gathering."
180,s181,Movie,Virus,Aashiq Abu,"Revathy, Kunchako Boban, Parvathy Thiruvoth",India,,2019,ALL,149 min,"Drama, Science Fiction, Suspense","Virus is a fiction based on true events, revolving around the deadly Nipah virus epidemic scare in Calicut, in 2018. A zoonotic disease top-listed by WHO, with no vaccination and treatment protocol, the deadly Nipah kills 75 % of those affected. Virus movie documents how the community spirit of a small town, in a tiny state of India, managed to fight the battle and win."
607,s608,Movie,The Immortalists,"David Alvarado, Jason Sussberg","Bill Andrews, Aubrey de Grey, Colin Blakemore, Adelaide Carpenter, Terry Grossman, Leonard Hayflick, Randy Lee","United Kingdom, United States, India",,2014,7+,77 min,"Documentary, Special Interest","What would the world look like if humans never grew old? Two eccentric biologists are determined to find out. In this larger-than-life doc, Bill Andrews and Aubrey de Grey leave behind the journals and peer reviews of the scientific establishment to embark on a quest for the age-old secret of eternal youth."
983,s984,Movie,Sketchy Behaviour,Neville Shah,"Kanan Gill, Kenneth Sebastian",India,,2019,PG-13,64 min,"Arts, Entertainment, and Culture","Sketchy Behaviour is an absurd sketch comedy show filmed live in Mumbai. Described as hilarious, complex, stupid, irritating(and ‘sardonic’ by one lady in Goa) the show is familiar, bizarre and hysterically funny. Featuring six very silly live sketches, stitched together by a much sillier story and bookended by an extremely silly opening and closing, Sketchy Behaviour is truly a work of something."
1046,s1047,Movie,Shaadi Mubarak,Padmasri,"Sagar RK Naidu, Drishya Raghunath",India,,2021,ALL,133 min,"Comedy, Drama","Madhav, an introverted software employee who gets compelled to meet 3 brides of alliances arranged by a marriage bureau run by Jayamma. Bhanumati, daughter of Jayamma, a happy, go-lucky girl had to accompany Madhav in meeting his set alliances. In the journey, they find love in each other, yet, they don't express it. The story takes new turns with each alliance they meet."
1208,s1209,Movie,Rangasthalam,Sukumar,"Ram Charan, Samantha Akkineni, Aadhi Pinisetty, Anasuya Bharadwaj, Jagapati Babu",India,,2018,7+,174 min,"Drama, International, Suspense",The story is set in a village called Rangasthalam. Chitti Babu (Ram Charan) happy-go-lucky man who has a hearing disability and he doesn’t let his disability deter him. His brother Kumar Babu (Aadhi Pinisetty) returns from Dubai only to see that nothing in the village has changed. What happens when he decides to go up against the dreaded President garu (Jagapathi Babu) forms the rest of the story.
1470,s1471,Movie,Notebook,Nitin Kakkar,"Zahir Iqbal, Pranutan Bahl",India,,2019,ALL,112 min,"Drama, International, Romance","Kabir comes to Kashmir to be a school teacher. The school is situated in the middle of the remote Wuller lake, lacking basic amenities and attended by just a handful of students. At the school Kabir finds a notebook left behind by the previous year's teacher Firdaus and that changes his entire life. Happy and heart-warming Notebook is about two people finding love in the most unexpected way."
1498,s1499,Movie,NGK,K. Selvaraghavan,"Suriya, Sai Pallavi, Rakul Preet Singh",India,,2019,ALL,147 min,Drama,"Suriya plays the title role Nandha Gopalan Kumaran, who has completed M.Tech, Ph.D doing organic farming for his living and do social work without any returns, leaving the corporate job, living a happy life with his parents and wife Sai Pallavi. At one point of time, opposition party's Bala Singh induces the idea of joining him in politics and circumstances led him to join the party too."
1544,s1545,Movie,My Name is Salt,Farida Pacha,,"Switzerland, India",,2013,ALL,92 min,"Arts, Entertainment, and Culture, Documentary, Special Interest","Year after year, just after the monsoon season has finished, thousands of families travel to a bleak desert in Gujerat, India, where they will stay for an endless eight months and extract salt from the earth, using the same painstaking, manual techniques as generations before them. Director Farida Pacha spent a season with one of these families, observing the very particular rhythms of their lives"
1625,s1626,Movie,Monster,Nelson Venkatesan,"SJ Surya, Priya Bhavani Shankar, Karunakaran, Anil Kumar",India,,2019,ALL,138 min,"Comedy, Drama",A compassionate man who believes that earth is for every living creature gets troubled by a rat and tries to kill it. Did he kill it or let it go free is the crux of the story.
1973,s1974,Movie,Kadaikutty Singam,Pandiraj,"Karthi, Sayyeshaa, Sathyaraj, Priya Bhavani Shankar, Arthana Vijayakumar, Soori",India,,2018,ALL,148 min,"Action, Adventure, Drama","Gunasingam, a family-loving farmer who hails from a small town, tries his best to keep his big family united."
2081,s2082,Movie,Ishaqzaade,Habib Faisal,"Arjun Kapoor, Parineeti Chopra",India,,2012,PG,132 min,International,"Rising from the ashes of hooliganism & small town clan wars, comes the love story of a passion ignited by hatred. Of two people. Born to hate. Destined to love. A story about two fiery bloods played by Arjun Kapoor & Parineeti Chopra, and their fight for power & supremacy. A story about love brewing in the often unrealistic and daunting political confines of rural India. A story called ISHAQZAADE."
2303,s2304,Movie,Goyenda Junior,Mainak Bhaumik,"Rwitobroto Mukherjee, Shantilal Mukherjee, Anusha Viswanathan",India,,2019,ALL,118 min,"International, Suspense","Bikram (Rwitobroto Mukherjee), a teenage boy, spends his days mooning over his crush Tuki (Anusha Viswanathan), and reading lots of crime fiction. An odd twist of events leads Bikram on a quest to solve the perfect crime - a murder cleverly disguised as a natural death !"
3696,s3697,Movie,Anbirkiniyal,Gokul,"Keerthi Pandian, Arun Pandian, Praveen Raja",India,,2021,ALL,123 min,"Drama, Suspense",True to her name the protagonist is a lovable girl. She doesn't return home from work one day and a search is triggered thereafter.
3712,s3713,Movie,Tumhari Sulu,Suresh Triveni,"Vidya Balan, Neha Dhupia, Manav Kaul, Vijay Maurya, Santanu Ghatak, Malishka Mendonsa, Vibhawari Deshpande, Abhishek Sharrma, Seema Taneja, Sindhu Shekharan, Trupti Khamkar, Siddhaanth Samant, Uday Lagoo",India,,2017,ALL,139 min,"Comedy, Drama, International","Vidya Balan (Sulochana a.k.a. Sulu) essays the role of a beautiful, enthusiastic and happy-go-lucky Mumbai housewife whose routine life changes when she unexpectedly lands herself with the exciting job of a night RJ (radio jockey) on a leading radio station."
3762,s3763,Movie,Srinivasa Kalyanam,Satish Vegesna,"Nithin, Raashi Khanna, Nandita Swetha",India,,2018,ALL,139 min,"Drama, International","Vasu, an architect from a close-knit joint family and Sri, daughter of a billionaire businessman fall in love with each other. Both families agree to their marriage but Sri’s father who believes time is more important than relations and rituals makes Vasu sign a premarital agreement in return of his promise to be present wherever the father of the bride is needed in all the wedding activities."
3787,s3788,Movie,Raatchasi,Sy Gowthamraj,"Jyotika, Poornima Bhagyaraj, Satyan, Hareesh Peradi",India,,2019,ALL,133 min,"Drama, International, Kids","Geetha Rani, the new headmistress of a Government School, has to confront misbehaving students, lethargic faculty and non-existent routines. As she faces these difficulties, will she be able to reform the education system and the society?"
3819,s3820,Movie,Maharshi,Vamshi Paidipally,"Mahesh Babu, Allari Naresh, Pooja Hegde","India, United States",,2019,7+,177 min,"Action, Drama, International","Rishi, a millionaire businessman, returns to his homeland, where he becomes the champion of poor and downtrodden farmers. Directed by Vamsi Paidipally, Maharshi features Mahesh Babu and Pooja Hegde in central roles."
4132,s4133,Movie,Ninnu Kori,Shiva Nirvana,"Nani, Nivetha Thomas, Aadhi Pinisetty",India,,2017,ALL,136 min,"Drama, International, Romance",This story is about Uma and Pallavi. While Pallavi proposes to elope Uma resents due to his scholarship deadlines asks for one more year. Pallavi ends up getting married to her parent's choice. She heads to USA post marriage. After one year Uma also lands up in USA to meet Pallavi and proposes to marry her.
4505,s4506,Movie,Saina,Amole Gupte,"Parineeti Chopra, Manav Kaul, Meghna Malik, Shubhrajyoti Barat",India,,2021,ALL,134 min,"Drama, Sports",World Champion. Olympic Medallist. The Doyen Of Indian Badminton. Saina Nehwal Is All Of This And Much More. This Biopic Chronicles The Inspiring Story Of A Gifted Youngster's Ascendance To The Pinnacle Of The Badminton World Through Sheer Passion And Perseverance - A Journey That Has Since Inspired And Empowered An Entire Nation.
4636,s4637,Movie,Junooniyat,Vivek Agnihotri,"Pulkit Samrat, Yami Gautam, Hrishitaa Bhatt, Aneesha Joshi, Taran Bajaj, Manoj Bakshi, Madhuri D. Bandiwedkar, Manann Dania, Gulshan Devaiah, Jaquiline Garewal, Gurpreet Kaur, Ravi Khemu, Sanjay Mehandiratta, Anoop Singh, Herry Tangiri, Khushboo Upadhyay",India,,2016,ALL,122 min,"Drama, International, Romance","Captain Jahan Bakshi rescues a Punjabi girl, Suhani. This starts a friendship that evolves into a passionate love affair."
4638,s4639,Movie,Hindi Medium,Saket Chaudhary,"Irrfan Khan, Saba Qamar, Neha Dhupia, Amrita Singh, Deepak Dobriyal, Sanjana Sanghi, Rajesh Sharma, Tillotama Shome, Vijay Kumar Dogra, Sumit Gulati, Swati Das, Delzad Hiwale, Taran Bajaj, Angad Dev Dogra, Sanjay Suri, Rajiv Gupta, Charu Shankar, Mallika Dua, Fasih Safwi, Jaspal Sharma",India,,2017,ALL,132 min,"Comedy, Drama, International",A couple want to give their daughter the best education so she will be accepted by the elite.
4718,s4719,Movie,Rock On,Abhishek Kapoor,"Arjun Rampal, Farhan Akhtar, Luke Kenny, Purab Kohli, Prachi Desai, Shahana Goswami, Koel Purie, Nicolette Bird",India,,2008,ALL,145 min,"Arts, Entertainment, and Culture, Drama, International","Four talented friends(Farhan Akthar, Purab Kholi, Arjun Rampal and Luke Kenny) pursue their passion making it big as a band, only to fail. Years later, fate brings them together with a second chance. After struggling through the rough patches, Adi, Joe, KD and Rob eventually form the country's best band, Magic and rock the nation with their outstanding live performances."
4927,s4928,Movie,Ta Ra Rum Pum,Siddharth Anand,"Rani Mukerji, Saif Ali Khan, Shruti Seth, Victor Banerjee, Dolly Bindra, Jaaved Jaaferi, Angelina Idnani, Ali Haji","United States, India",,2007,ALL,156 min,"Drama, International, Kids","When RV (Saif Ali Khan) is spotted by Harry (Jaaved Jaafery) the Manager of a failing Racing car team, everything changes for RV and the team. They shoot to the top. The dream is complete when he meets Radhika (Rani Mukerji) and both tie the knot. But when he meets with an accident, he loses everything he had once gained. RV is on the road, but can he reclaim the glory for his family?"
5013,s5014,Movie,Nizhal,Appu N. Bhattathiri,"Kunchacko Boban, Nayanthara, Divya Prabha",India,,2021,ALL,124 min,Suspense,"John Baby, who is recouping from a traumatic accident, meets Nitin, a young boy who interests him with murder stories. When Baby explores the possibility of Nitin's stories by mapping the events, it matches with the real-time incidents."
5172,s5173,Movie,Saathiya,Shaad Ali,"Rani Mukerji, Tanuja, Satish Shah, Vivek Oberoi, Sandhya Mridul, Swaroop Sampat, Sharat Saxena, Tinnu Anand",India,,2002,ALL,138 min,"Drama, International, Romance","""Running away from home can’t keep a couple together. Love can. While for most Love Stories, marriage is the goal, the fact remains -marriage is just the beginning. A story of Aditya (Vivek) and Suhani (Rani Mukerji) SAATHIYA continues from where most love stories end. From the infatuation stage when a couple thinks they are in love right through to when they discover the true meaning of love."""
5237,s5238,Movie,Yeh Dillagi,Naresh Malhotra,"Kajol, Akshay Kumar, Saif Ali Khan, Deven Verma, Achyut Potdar, Reema Lagoo, Saeed Jaffrey",India,,1994,ALL,154 min,"Drama, International, Romance","Sapna (Kajol) was a frequent visitor to the Saigal mansion as her father was a trusted driver of the family. When she is reminded of her social status by the rich brat Vicky Saigal (Saif Ali Khan), she leaves town to make something of herself. She returns as a successful model and Vicky falls for her. The problem - his elder brother Vijay (Akshay Kumar) is already in love with the same girl."
5239,s5240,Movie,Tubelight,Kabir Khan,"Salman Khan, Sohail Khan, Om Puri, Mohammed Zeeshan Ayyub, Yashpal Sharma, Zhu Zhu, Matin Rey Tangu, Brijendra Kala, Isha Talwar, Jason D'Souza, Matt Kramer, Neeraj Khetarpal, Kapil Sharma","India, United States, United Kingdom, Canada, China",,2017,ALL,130 min,"Drama, International","In a small picturesque town of North India, lives Laxman with his younger brother Bharat. Laxman's world comes crashing down, when war breaks out and Bharat gets drafted into the Army. Seeing the carnage around him and worried for his brother, the simple - minded Laxman decides to stop this conflict and get his brother back. TUBELIGHT set in 1962 tells the story of one man's unshakeable belief."
5240,s5241,Movie,Theri,Atlee Kumar,"Vijay, Samantha Ruth Prabhu, Amy Jackson, Baby Nainika, Prabhu, Raadhika Sarathkumar, Rajendran, J.Mahendran",India,,2016,ALL,150 min,"Action, Drama, International",Joseph (Vijay) lives in a small town of Kerala. He lives with his 6-year old daughter (Baby Nainika as Nivi) and his close ally Rajendran. Annie (Amy Jackson) is Nivi's class teacher who develops an interest over Joseph. This peaceful life of Joseph is shaken when a group of local goons from Kerala crosses path with him.
5245,s5246,Movie,Silsila,Yash Chopra,"Shashi Kapoor, Amitabh Bachchan, Jaya Bhaduri, Rekha, Sushma Seth, Jagdish Raj, Kulbhushan Kharbanda, Deven Verma, Sanjeev Kumar, Pratima Puri, Ashok Verma, Manek, Kimti Anand, Nirupama Verma, Damyanti Puri, Gauri Shanker, Raj Babbar, Shyam Arora, Ranvir Raj, Vikas Anand, Sharmila Roy Chowdhry, Ravi Dubey, Sudha Chopra",India,,1981,7+,180 min,"Drama, International, Romance","Amit (Amitabh Bachchan) decides to bury his past life along with his love for Chandni (Rekha) when he meets Shobha (Jaya Bachchan). Shobha's life has come to a standstill after her fiance and Amit’s brother Shekhar (Shashi Kapoor) dies in a crash. When fate brings Amit and Chandni face to face again, both are married to different people - but neither can ignore their feelings for each other."
5247,s5248,Movie,SI 3,Hari,"Suriya, Anushka Shetty, Shruthi Hasan, Soori, Anoop Singh Thakur, Neetu Chandra, Janaki Ganesh, Olamilekan Akanbi Jason, Krish",India,,2017,ALL,152 min,"Action, International","A reputed cop from Tamil Nadu takes charge in Andhra Pradesh to solve the mysterious murder of a top police officer, and takes on local thugs and criminals during the course of his mission."
5252,s5253,Movie,Rab Ne Bana Di Jodi,Aditya Chopra,"Shah Rukh Khan, Anushka Sharma, Rani Mukerji, Manmeet Singh, Kajol, Bipasha Basu, Lara Dutta, Preity Zinta, Vinay Pathak",India,,2008,ALL,164 min,"Drama, International, Romance","This is a story of Surinder Sahni (Shahrukh Khan) - a simple, clean hearted, honest man, leading a humdrum life, when he meets his total opposite and finds love in the flamboyant, fun-loving, vivacious - Taani (Anushka Sharma). What follows is a journey filled with laughter, tears, joy, pain, music, dance...that makes us believe that there is an extraordinary love story in every ordinary couple."
5266,s5267,Movie,Mashaal,Yash Chopra,"Anil Kapoor, Waheeda Rehman, Dilip Kumar, Rati Agnihotri, Saeed Jaffrey, Amrish Puri",India,,1984,ALL,169 min,"Drama, International","MASHAAL is a story about Vinod (Dilip Kumar) an honest, fearless editor of an outspoken newspaper, Raja (Anil Kapoor) a man from the slums who takes to black marketing to make his living and Vardhan (Amrish Puri) who is a powerful and respected figure of the city whose cloak of respectability hid all the social evils. In an attempt to combat Vardhan, life ends up differently for Vinod and Raja."
5271,s5272,Movie,Lamhe,Yash Chopra,"Anil Kapoor, Sridevi, Anupam Kher, Waheeda Rehman",India,,1991,ALL,188 min,"Drama, International, Romance","Viren (Anil Kapoor) comes to India, he is captivated by Pallavi (Sridevi). When he learns she's spoken for, he returns. When he gets the news of Pallavi and her husband dying and leaving their daughter Pooja (Sridevi) behind, Viren ensures she is taken care of. 20 years on, Viren comes back to India and sees Pooja - a spitting image of her mother! What follows is a life-changing turn of events."
5273,s5274,Movie,Kal Ho Naa Ho,Nikkhil Advani,"Shah Rukh Khan, Preity Zinta, Saif Ali Khan, Jaya Bhaduri, Sushma Seth, Reema Lagoo, Lilette Dubey, Delnaz Paul, Sonali Bendre, Rani Mukerji, Sanjay Kapoor, Sulabha Arya, Athit Naik, Jhanak Shukla",India,,2003,ALL,187 min,"Comedy, Drama, International","Naina Kapur is a beautiful introvert and often keeps to herself. Her life soon changes, when she befriends her neighbour, Aman Mathur, who is jaunty and bubbly. Naina falls in love with Aman and decides to confess her love to him. She is heart-broken, when she finds out that Aman is married. But the truth unravels, and Aman has lied about being married. His lie hides a dark secret."
5276,s5277,Movie,Kabali,Pa. Ranjith,"Rajinikanth, Winston Chao, Radhika Apte, Dhansika, Dinesh Ravi, Kishore, Kalaiyarasan, John Vijay, Riythvika, Rosyam, Lingesh Vj, Mime Gopi, Nassar, R. Amarendran, Uday Mahesh, Nandakumar, Gajaraj, Charles Vinoth, Sampath Ram, Sangili Murugan",India,,2016,ALL,143 min,"Action, Drama, International","Kabali, a revolutionary who fights for the betterment of his people in a foreign land, is falsely implicated and thrown behind bars. When he returns after his prison term, he starts a search for his wife and ends up confronting those who were the reason behind his miseries. What follows is a tale of revenge, emotion and payback."
5278,s5279,Movie,Joker,Raju Murugan,"Guru Somasundaram, Ramya Pandiyan, Gayathri, Ramasamy, Bava Chelladurai, Bala Murugan",India,,2016,ALL,129 min,"Comedy, Drama, International","Mannar (protagonist), a villager, who declares himself as Indian President, protests government for absurdities. On a trial, he reveals his past. When everyone sees him as Joker, audience are questioned at the end."
5290,s5291,Movie,Dilwale Dulhania Le Jayenge,Aditya Chopra,"Shah Rukh Khan, Kajol, Amrish Puri, Farida Jalal, Anupam Kher, Satish Shah, Achala Sachdev, Himani Shivpuri",India,,1995,7+,190 min,Romance,"When Raj (Shahrukh Khan) & Simran (Kajol) first met on an inter-rail holiday in Europe, it wasn’t exactly Love at first sight but when Simran is taken back to India for an arranged marriage, things change. Encouraged by his father Dharamvir (Anupam Kher), Raj decides to fly down from London to not just win his Bride but her whole family and the blessings of her father Baldev Singh (Amrish Puri)."
5296,s5297,Movie,Daag,Yash Chopra,"Rajesh Khanna, Sharmila Tagore, Rakhee Gulzar, Prem Chopra, Madan Puri, Iftekhar, Manmohan Krishna, Kader Khan, Achala Sachdev, A.K. Hangal",India,,1973,7+,146 min,"Drama, International","Sunil (Rajesh Khanna) is forced to leave behind his new bride Sonia (Sharmila Tagore), when he kills her would-be rapist. A new identity beckons when Sunil meets Chandni (Rakhee) and ends up marrying her to give her illegitimate child a father’s name. Now a respected Mayor of his town, Sunil’s past catches up with him and brings together Sunil and Sonia. Can he outrun his destiny for long?"
5297,s5298,Movie,Chandni,Yash Chopra,"Vinod Khanna, Rishi Kapoor, Sridevi, Waheeda Rehman, Sushma Seth, Beena Banerjee",India,,1989,ALL,180 min,"Drama, International, Romance","In a cruel stroke of fate, Chandni’s (Sridevi) heart is shattered as Rohit (Rishi Kapoor) disappears from her life. When she meets Lalit (Vinod Khanna) who is fighting the demons of tragic memories, they both find solace in this new friendship. Lalit’s affection gives a new direction to Chandni’s life, but Lalit falls for her and Chandni resigns to destiny, till one day, Rohit knocks on her door."
5301,s5302,Movie,Band Baaja Baaraat,Maneesh Sharma,"Ranveer Singh, Anushka Sharma, Manish Chaudhary",India,,2010,ALL,139 min,Romance,"Shruti (Anushka Sharma), girl in her 20's, focused, determined as well ambitious. Bittoo (Ranveer Singh), on the other hand, has no real aim in life. They become partners in their very own “Wedding planning ka bijness”. Together, their friendship and business, enters the ups and downs of the lavish Delhi weddings and while trying to find themselves, Shruti and Bittoo discover each other."
5306,s5307,Movie,Adhe Kangal,Rohin Venkatesan,"Kalaiyarasan, Janani Iyer, Sshivada",India,,2017,ALL,119 min,"International, Romance","A blind chef gets his eyesight back, but the girl he had fallen in love with is missing. What has happened to her? Is morphed into thriller followed by an abduction."
5307,s5308,Movie,Aamhi Doghi,Pratima Joshi,"Priya Bapat, Mukta Barve, Krutik Mazire, Bhushan Pradhan",India,,2018,ALL,138 min,"Drama, International","Friendship blossoms in various relationships. Sometimes we find our best friends in a relationship designed by fate. Two women who found each other, in the midst of living parallel lives, have woven together a story of understanding. Comfort and compassion can be found where least expected. One is never alone when together with another."
5308,s5309,Movie,Aaja Nachle,Anil Mehta,"Madhuri Dixit, Darshan Jariwala, Raghuvir Yadav, Divya Dutta, Irrfan Khan, Kunal Kapoor, Konkona Sen Sharma, Ranvir Shorey, Vinay Pathak",India,,2007,ALL,143 min,Drama,"An unexpected phone call shakes Dia (Madhuri Dixit) on hearing her guru, is dying and she must return to India. It is a troubled return; not only has her guru passed away, but the institution that he so lovingly nurtured is in under threat of demolition. Ajanta theatre, the once vibrant hub. Dia promises to turn this ruin into a bustling theatre that was once the soul of her little town."
5360,s5361,Movie,Bokya Satbande,Raj Pendurkar,"Dilip Prabhavalkar, Aryan Narvekar, Kaluram Dhobale, Alok Rajwade",India,,2009,ALL,126 min,Kids,"'Bokya Satbande' is the story of a ten-year-old boy, Bokya and the adventures of his fun filled childhood."
5830,s5831,Movie,Aashiqui,Mahesh Bhatt,"Rahul Roy, Anu Aggarwal, Avtar Gill, Tom Alter, Reema Lagoo, Homi Wadia, Mushtaq Khan, Javed Khan, Deepak Tijori, Anang Desai, Veerendra Saxena, Sunil Rege, Deepa Mehta",India,,1990,ALL,145 min,"Drama, International, Romance",A small-time singer struggling for a break gets his share of fame when his girlfriend becomes a successful model. Their relationship suffers when he begins to feel burdened by her popularity.
5864,s5865,Movie,Be Dune Saade Chaar,Girish Mohite,"Mohan Joshi, Sai Tamhankar, Sanjay Narvekar, Atul Parchure, Vandana Gupte, Mugdha Shah, Sushant Shelar, Resham Tipnis, Satish Phulekar, Uday Sabnis, Sneha Wagh",India,,2009,ALL,132 min,Comedy,"Anant Kitturkar (Mohan Joshi) has actually achieved the extraordinary feat of marrying two women - Manorama (Vandana Gupte) and Anjali (Mugdha Shah) - who are unaware of each other's existence. Lies, deceit and fake identities have made Anant confident that this secret will go with him to his grave. But there's something else in store for him. And now it's pay-off time."
5872,s5873,Movie,Tula Shikwin Changlach Dhada,Girish Mohite,"Makarand Anaspure, Sanjay Narvekar, Rujuta Deshmukh, Kadambari Kadam, Mohan Joshi, Uday Sabnis, Jaywant Wadkar, Saurabh Parakhe, Vikas Samudre",India,,2007,ALL,152 min,Comedy,A struggling actor (Sanjay Narvekar) falls in love with a woman (Rujuta Dehmukh) and marries her without realizing that her uncle (Mohan Joshi) is the director who had rejected him. He then comes up with a plan to teach him a lesson.
5934,s5935,Movie,Kuch Kuch Hota Hai,Karan Johar,"Shah Rukh Khan, Kajol, Rani Mukerji, Farida Jalal, Reema Lagoo, Himani Shivpuri, Johnny Lever, Anupam Kher, Salman Khan, Archana Puran Singh, Sana Saeed",India,,1998,ALL,185 min,"Comedy, Drama, Music Videos and Concerts","'Kuch Kuch Hota Hai' is a Bollywood blockbuster of all times, a coming-of-age rom-com involving two love triangles set in different phases of life. Two best friends Anjali and Rahul are set apart, when a new girl named, Tina, enters Rahul's life. Years later, deceased Tina's daughter takes it upon herself to reunite the estranged lovers. But, Anjali is engaged to Aman. Who will Anjali choose now?"
5939,s5940,Movie,Kabhi Khushi Kabhie Gham,Karan Johar,"Amitabh Bachchan, Shah Rukh Khan, Hrithik Roshan, Kajol, Kareena Kapoor, Farida Jalal, Alok Nath, Johnny Lever, Jaya Bhaduri Bachchan",India,,2001,ALL,209 min,"Drama, Romance","Yashvardhan Raichand is a snobbish man, he breaks ties with his elder son Rahul, for marrying a girl with lower social status. When his younger son Rohan returns home, he is upset to know that his brother no longer lives with them. Rohan decides to reunite his family and goes to London and finds Rahul. But, the question is will he be successful in convincing his egoistic father for a reunion?"
