,show_id,type,title,director,cast,country,date_added,release_year,rating,duration,listed_in,description
1646,s1647,TV Show,The Titan Games,,,United States,"May 26, 2020",2019,TV-PG,1 Season,"Family, Health & Wellness, Reality","Inspired by Dwayne Johnson's desire to motivate audiences, this competition offers everyday people the chance to step inside the Titan arena and compete in incredible head-to-head battles designed to test their minds, bodies and hearts."
1657,s1658,TV Show,K.C. Undercover,,,United States,"May 21, 2020",2015,TV-Y7,3 Seasons,"Black Stories, Comedy, Family","High school student K.C. Cooper goes undercover as the government's newest secret agent! With her spy family by her side, her wits, and arsenal of gadgets, she's ready for any covert operation, or homework assignment. Join K.C. as she learns that growing up in a family of spies means sharing every mission."
1683,s1684,TV Show,The Little Couple,,,United States,"May 15, 2020",2009,TV-PG,2 Seasons,"Documentaries, Reality","Follow Bill Klein and Jen Arnold as they embark on all the ups and downs of life together. They’ve faced not only the struggles of two little people in an average-sized world, but also the challenges and joys of a growing family."
1684,s1685,TV Show,Just Shoot Me,,,United States,"May 13, 2020",1997,TV-PG,7 Seasons,"Comedy, Sitcom","Fashion and mayhem at the offices of Blush magazine, where Maya, (Laura San Giacomo of Sex, Lies, & Videotape and Pretty Woman) works for her father (George Segal) and a host of eccentric and neurotic co-workers. There's Nina (Wendy Malick), a libido-driven ex model, Elliot (Enrico Colantoni), the magazine's photographer and Dennis (David Spade), her father's power hungry assistant."
1691,s1692,Movie,The Hustle,,,United States,"May 7, 2020",2019,PG-13,94 min,Comedy,Rebel Wilson and Anne Hathaway have winning chemistry as a pair of con artists plying their trade in a stunning seaside town in the south of France as they compete to swindle a naive tech prodigy (Alex Sharp) out of his considerable fortune.
1695,s1696,Movie,The 33,,,"Chile, Colombia, Spain, United States","May 5, 2020",2015,PG-13,127 min,Drama,The 2010 Chilean mine disaster and the 69-day effort to rescue the 33 miners who were trapped underground is chronicled.
1716,s1717,Movie,Cunningham,,,"Germany, France, United States","April 23, 2020",2019,PG,93 min,"Documentaries, Music","Traces legendary American choreographer Merce Cunningham’s artistic evolution from his early years in postwar New York to his emergence as one of the world’s most visionary choreographers. A breathtaking explosion of dance, music."
1734,s1735,Movie,Jesus Camp,,,United States,"April 8, 2020",2006,PG-13,85 min,Documentaries,"Jesus camp follows three kids to Pastor Becky Fischer's ""Kids on Fire"" camp where young kids are taught to become Christian soldiers in ""God's army."" The kids hone their ""prophetic gifts"" and are schooled in how to ""take back America for Christ."""
1740,s1741,Movie,The Queen of Versailles,,,"United States, Netherlands, United Kingdom, Denmark","April 8, 2020",2012,PG,101 min,Documentaries,The Queen of Versailles is a character-driven documentary about a billionaire family and their financial challenges in the wake of the economic crisis.
1756,s1757,TV Show,The Kitchen,,,United States,"April 1, 2020",2014,TV-G,3 Seasons,"Cooking & Food, Lifestyle & Culture","Looking for recipes and meal tips from an all-star lineup of Food Network hosts? Then ""The Kitchen"" is for you. The hourlong show, featuring hosts Sunny Anderson, Katie Lee, Jeff Mauro, Marcela Valladolid and Geoffrey Zakarian, shares simple dinner recipes and family meal tips, plays trivia games, and answers viewer questions in addition to just shooting the breeze about all things food. With a roster that includes a ""Food Network Star"" winner who specializes in making sandwiches, an Iron Chef, and a Tijuana native who is known for her Mexican cuisine, there's sure to be something of interest for all home cooks in Food Network's ""Kitchen."""
1785,s1786,TV Show,Life in Pieces,,,United States,"March 2, 2020",2015,TV-PG,4 Seasons,"Comedy, Sitcom","Life in Pieces is a comedy about one big happy family and its sometimes awkward, often hilarious and ultimately beautiful milestone moments as told by its various members."
1792,s1793,TV Show,Bless This Mess,,,United States,"February 24, 2020",2019,TV-PG,2 Seasons,"Comedy, Sitcom","Newlyweds Rio and Mike make the decision to move from big city New York to rural Nebraska. After dropping everything (including their jobs and overbearing mother-in-law) to make the move from skyscrapers to farmhouses, they soon realize that the simpler life isn’t as easy as they planned. Rio and Mike must now learn how to weather the storm as they are faced with unexpected challenges in their new life as farmers."
1796,s1797,Movie,Getaway,,,"United States, Bulgaria","February 19, 2020",2013,PG-13,90 min,"Action, Adventure, Horror",A washed-up race car driver finds himself in a race against time to save his abducted wife in this heart-pounding thriller.
1798,s1799,Movie,And So It Goes,,,United States,"February 15, 2020",2014,PG-13,94 min,"Comedy, Drama, Romance",A self-absorbed realtor enlists the help of his neighbor when he's suddenly left in charge of the granddaughter he never knew existed until his estranged son drops her off at his home.
1866,s1867,TV Show,I Am Jazz,,,United States,"January 29, 2020",2015,TV-PG,1 Season,"Documentaries, LGBTQ+, Reality","Jazz Jennings is the typical 14 year old girl in all ways but one Jazz was assigned male at birth. Her supportive family accepted Jazz as a girl at a young age, but with her teenage years upon them, they're in for a whole new set of challenges."
1869,s1870,TV Show,Cooks vs. Cons,,,United States,"January 22, 2020",2016,TV-G,3 Seasons,"Cooking & Food, Family, Lifestyle & Culture","Geoffrey Zakarian, a master of modern American cuisine, hosts the next generation of cooking competition, a battle which asks the ultimate question: could a talented home cook beat a pro, or does a true professional have skills that no amateur could match?"
1871,s1872,TV Show,Flea Market Flip,,,United States,"January 22, 2020",2012,TV-G,4 Seasons,"Family, Lifestyle & Culture",Contestants are given $500 to buy items that they can then flip and clean up for a larger profit.
1872,s1873,TV Show,Good Eats: Reloaded,,,United States,"January 22, 2020",2018,TV-G,1 Season,"Cooking & Food, Lifestyle & Culture","Alton Brown renovates, updates and repairs classic episodes by offering brand-new recipes and kitchen tips. He also gives a behind-the-scenes look at the show's production that will leave superfans wanting more."
1877,s1878,Movie,"Life, Animated",,,United States,"January 19, 2020",2016,PG,92 min,Documentaries,"From Academy Award® winning director Roger Ross Williams comes the story of Owen Suskind, a young man who couldn’t speak as a child until he discovered a unique way to communicate by immersing himself in the world of Disney animated films."
1878,s1879,TV Show,Gold Rush: Dave Turin's Lost Mine,,,United States,"January 18, 2020",2019,TV-PG,1 Season,"Action, Adventure, Reality","A fan favorite of Discovery's popular ""Gold Rush"" series sets out on a new adventure to continue his pursuit of the prized yellow stuff. Dave Turin spent years working alongside Todd Hoffman, earning the nickname ""Dozer Dave"" because of the many hours he spent bulldozing for gold. In his return, Dave is his own boss, and he's on a mission to find an abandoned mine to resurrect in the hope that old-timers left gold behind. He explores the history of each mine, a search that culminates in Dave picking the one that he can turn into newfound riches."
1898,s1899,TV Show,The Curse of Oak Island,,,United States,"January 1, 2020",2014,TV-PG,6 Seasons,"Documentaries, History, Reality","In 1795, three teenage boys discovered a strange, man-made hole on Oak Island, a small, wooded island just off the coast of Nova Scotia, Canada. As the boys began to dig, they found a number of intriguing artifacts."
1910,s1911,Movie,Elvira: Mistress of the Dark,,,United States,"December 31, 2019",1988,PG-13,96 min,"Comedy, Horror","Cassandra Peterson stars in this sexy comedy hit, filled with wild wisecracks, campy chaos and scary movie spoofs."
1924,s1925,Movie,The Heart of Christmas,,,United States,"December 31, 2019",2011,TV-G,90 min,"Drama, Family",Megan (Candace Cameron Bure) re-examines her priorities after she sees people decorating for Christmas in October to help a family celebrate Christmas with their dying son.
1941,s1942,Movie,Lo and Behold: Reveries of the Connected World,,,United States,"December 23, 2019",2016,PG-13,98 min,Documentaries,"Oscar®-nominated documentarian Werner Herzog (Grizzly Man, Cave of Forgotten Dreams) chronicles the virtual world from its origins to its outermost reaches."
1950,s1951,TV Show,My Little Pony: Friendship Is Magic,,,"United States, Canada","December 20, 2019",2010,TV-Y,1 Season,"Family, Kids",Twilight Sparkle and her friends learn that by working together they can achieve harmony.
1957,s1958,Movie,Blackfish,,,United States,"December 12, 2019",2013,PG-13,83 min,Documentaries,"Killer whales are beloved, majestic, friendly giants, yet infamous for their capacity to kill viciously. Blackfish unravels the complexities of this dichotomy, employing the story of the notorious performing whale Tilikum, who – unlike any orca in the wild – has taken the lives of several people while in captivity. Blackfish expands on the discussion of keeping such intelligent creatures in captivity."
1968,s1969,Movie,How to Train Your Dragon: Homecoming,,,United States,"December 5, 2019",2019,TV-PG,,"Adventure, Family, Kids","This holiday season, reunite with Hiccup, Astrid, Toothless, Light Fury and all your friends on the Isle of New Berk in ""How to Train Your Dragon: Homecoming,"" a brand new adventure based upon the critically acclaimed How to Train Your Dragon film trilogy from DreamWorks Animation."
1972,s1973,TV Show,Making It,,,United States,"December 3, 2019",2018,TV-PG,1 Season,"Lifestyle & Culture, Reality",From executive producers and hosts Amy Poehler and Nick Offerman comes a uniquely lighthearted competition series reuniting two of pop culture's biggest BFFs and celebrating the creativity and craftiness in all of us.
1977,s1978,Movie,Mike Wallace Is Here,,,United States,"November 28, 2019",2019,PG-13,91 min,Documentaries,"An unflinching look at the legendary reporter, who interrogated the 20th century’s biggest figures in his over fifty years on air, and his aggressive reporting style and showmanship that redefined what America came to expect from broadcasters."
1986,s1987,Movie,The Tomorrow Man,,,United States,"November 18, 2019",2019,PG-13,95 min,"Drama, Romance","Ed Hemsler spends his life preparing for a disaster that may never come. Ronnie Meisner spends her life shopping for things she may never use. In a small town somewhere in America, these two people will try to find love while trying not to get lost in each other's stuff."
1996,s1997,Movie,The Biggest Little Farm,,,United States,"November 6, 2019",2018,PG,92 min,"Documentaries, Family",The Biggest Little Farm follows two dreamers and their beloved dog when they make a choice that takes them from their tiny L.A. apartment and into the countryside to build one of the most diverse farms of its kind in complete coexistence with nature.
1997,s1998,TV Show,BBQuest,,,United States,"November 5, 2019",2018,TV-G,2 Seasons,"Cooking & Food, Lifestyle & Culture","Barbecue enthusiast and native Texan Kelsey Pribilski is on a quest to find secret menu items at some of the best barbecue joints in Texas. This new original series by Beef Loving Texans follows Kelsey on her search for these undiscovered, off-menu options. With the help of some renowned chefs and prominent pitmasters, there’s no telling what might be found along the way."
2000,s2001,Movie,Denial,,,"United Kingdom, United States","November 4, 2019",2016,PG-13,110 min,Drama,A historian must battle for historical truth when she is sued for libel.
2008,s2009,TV Show,Kids Baking Championship,,,United States,"November 1, 2019",2015,TV-G,4 Seasons,"Cooking & Food, Family, Lifestyle & Culture",Several of the best child bakers in the country will do battle in a series of delicious challenges.
2010,s2011,Movie,Sinbad: Legend of the Seven Seas,,,"United States, United Kingdom, France","November 1, 2019",2003,PG,85 min,"Action, Adventure, Cartoons",Sinbad the sailor must retrieve the stolen Book of Peace from a goddess with a penchant for chaos in this mythological animated tale.
2013,s2014,Movie,In Search of Greatness,,,United States,"October 30, 2019",2018,PG-13,77 min,"Documentaries, Sports",IN SEARCH OF GREATNESS is a groundbreaking documentary that reveals the true nature and nurture of the greatest athletes of all time
2014,s2015,Movie,Meeting Gorbachev,,,"United Kingdom, Germany, United States","October 30, 2019",2018,TV-PG,91 min,Documentaries,Werner Herzog meeting Mikhail Gorbachev opens a fresh door to some of the most significant happenings of the late 20th Century from nuclear disarmament to the reunification of Germany and the end of the Cold War.
2023,s2024,TV Show,Pocket.watch EvanTubeHD Ultimate mishmash,,,United States,"October 18, 2019",2018,TV-G,1 Season,"Family, Kids","Share in the Tube Family fun with pocket.watch EvanTubeHD Ultimate mishmash! Watch YouTube star EvanTubeHD and his sister, JillianTubeHD, battle it out in challenges, play games, do amazing speed builds, and more!"
2024,s2025,TV Show,Pocket.watch HobbyKidsTV Ultimate mishmash,,,United States,"October 18, 2019",2018,TV-G,2 Seasons,Kids,"Come along on a learning adventure with pocket.watch HobbyKidsTV Ultimate Mishmash. Join popular YouTube family, HobbyKidsTV, in all of their playtime fun - including surprise eggs, games, challenges, and more!"
2026,s2027,Movie,Toni Morrison: The Pieces I Am,,,United States,"October 17, 2019",2019,PG-13,120 min,"Black Stories, Documentaries","This artful and intimate meditation on legendary storyteller Toni Morrison examines her life, her work and the powerful themes she has confronted throughout her literary career."
2037,s2038,Movie,Missing Link,,,"Canada, United States","October 7, 2019",2019,PG,94 min,"Action, Adventure, Comedy","""Missing Link"" is a globe-trotting comedy-adventure about a dashing investigator of myths and monsters (Hugh Jackman) and the surprisingly silly and soulful beast he discovers (Zach Galifianakis)."
2038,s2039,TV Show,A New Leaf,,,United States,"October 6, 2019",2019,TV-G,1 Season,"Lifestyle & Culture, Reality","Host Daisy Fuentes follows people on the cusp of key life inflection points, using family history, genealogy and sometimes DNA analysis to guide them on their journey of self-discovery, and help them learn from the past while looking to the future."
2039,s2040,TV Show,Consumer 101,,,United States,"October 6, 2019",2018,TV-G,1 Season,Lifestyle & Culture,Host Jack Rico explores the science used to test every kind of product – from the obscure to the fascinating to the everyday – as well as more efficient ways to get the most out of everyday items and unique career paths in science and technology.
2040,s2041,TV Show,The Champion Within,,,United States,"October 6, 2019",2017,TV-PG,1 Season,"Family, Reality, Sports","""The Champion Within"" features the powerful and inspiring stories of successful athletes who exemplify what it really means to be a champion. Hosted by Lauren Thompson of Golf Channel’s ""Morning Drive,"" ""The Champion Within"" introduces audiences to professional and amateur athletes who have overcome obstacles to ultimately achieve transcendent moments in the world of sports. ""The Champion Within"" proves that a champion is not only defined by their speed, strength and agility, but also by their grit, resilience and heart."
2041,s2042,TV Show,Vets Saving Pets,,,United States,"October 6, 2019",2018,TV-G,1 Season,"News, Reality, Science & Technology","At the Emergency Veterinary Trauma Center in Toronto, one of the busiest animal care facilities in Canada, veterinary professionals work together tirelessly to save the lives of animals in need of urgent medical care."
2046,s2047,Movie,Amazing Grace,,,United States,"October 2, 2019",2018,G,89 min,"Black Stories, Documentaries, Music","A documentary presenting the live recording of Aretha Franklin's album Amazing Grace at The New Temple Missionary Baptist Church in Watts, Los Angeles in January 1972."
2059,s2060,TV Show,OutDaughtered,,,United States,"October 1, 2019",2016,TV-PG,1 Season,"Documentaries, Reality","40 bottles a day, 420 diapers a week and feedings every three hours became the new normal for Danielle and Adam Busby when they welcomed home the only all-female set of quintuplets in the country. OutDaughtered follows Danielle, Adam and their adorable 4-year-old daughter Blayke as they adjust to their new normal."
2061,s2062,TV Show,The Dead Files,,,United States,"October 1, 2019",2013,TV-PG,2 Seasons,"Lifestyle & Culture, Reality","Physical medium, Amy Allan, and retired NYPD homicide detective, Steve DiSchiavi, are a paranormal team like no other. Combining their unique skills to solve unexplained paranormal phenomena in haunted locations across America."
2064,s2065,Movie,Teen Spirit,,,"United Kingdom, United States","September 30, 2019",2018,PG-13,93 min,"Drama, Family, Music","Violet (Elle Fanning) is a shy teenager who dreams of escaping her small town and pursuing her passion to sing. With the help of an unlikely mentor, she enters a local singing competition that will test her integrity, talent and ambition."
2065,s2066,TV Show,The Hills,,,United States,"September 30, 2019",2006,TV-PG,6 Seasons,"Reality, Teen","The Hills follows Lauren (“LC” from Laguna Beach) as she makes the move from her O.C. digs to Los Angeles, where she will chase her dreams on entering the fashion business while balancing a full course load at college and a full social calendar."
2068,s2069,TV Show,Fresh off the Boat,,,United States,"September 28, 2019",2015,TV-PG,6 Seasons,"Comedy, Family, Sitcom","It’s the '90s and 12 year old, hip-hop loving Eddie just moved to suburban Orlando from DC’s Chinatown with his parents. It’s culture shock for his immigrant family in this comedy about pursuing the American Dream."
2069,s2070,TV Show,Single Parents,,,United States,"September 26, 2019",2018,TV-PG,2 Seasons,"Comedy, Sitcom",A group of single parents lean on each other.
2084,s2085,Movie,Curious George: Royal Monkey,,,United States,"September 10, 2019",2019,G,87 min,"Action, Adventure, Comedy","Join your favorite monkey as he takes on his most regal role yet, trading places with a royal monkey!"
2100,s2101,TV Show,Designing Women,,,United States,"August 26, 2019",1986,TV-PG,7 Seasons,"Comedy, Sitcom","Ambitious Julia Sugarbaker and her sister, diva-like ex-beauty queen Suzanne, decide to open their own design firm. They are aided by close friends Mary Jo and Charlene. Also on hand is ex-con Anthony who provides the women with some moving muscle and his often unsolicited male opinion."
2140,s2141,Movie,Time Freak,,,United States,"July 22, 2019",2018,PG-13,105 min,"Comedy, Drama, Romance","Physics prodigy Stillman (Asa Butterfield) is destined for great things, only to be derailed when his girlfriend, Debbie (Sophie Turner) suddenly dumps him."
2141,s2142,Movie,Apollo 11,,,United States,"July 20, 2019",2019,G,93 min,Documentaries,"Crafted from a newly-discovered trove of 70mm footage, and more than 11,000 hours of uncatalogued audio recordings, Apollo 11 goes straight to the heart of NASA's most celebrated mission."
2163,s2164,TV Show,The Amazing World of Gumball,,,"United Kingdom, Ireland, United States, Germany, Japan, France","July 5, 2019",2011,TV-Y7,6 Seasons,"Cartoons, Comedy, Family","Gumball’s world is pretty run-of-the-mill. He’s chased around school by a T-Rex. He has a friend named Anton who’s a piece of toast. He’s got a crush on Penny, a peanut with antlers. His dad is a 6’4” bunny. His mom works at a Rainbow Factory. And his brother is a goldfish named Darwin. Yup, everything looks perfectly normal here."
2179,s2180,TV Show,The Riveras,,,United States,"June 21, 2019",2016,TV-PG,2 Seasons,"Latino, Music, Reality","Los Rivera son la familia consentida de la música regional mexicana, pero nunca antes la habían mostrado así. Chiquis y sus hermanos luchan por salir adelante. Con humor y amor logran sus metas."
2190,s2191,Movie,The Lonely Man,,,United States,"June 1, 2019",1957,TV-G,87 min,"Action, Adventure, Drama",The past-and the future-close in on a reformed gunslinger. The Lonely Man belongs to that saddlebag full of Westerns about a gunslinger coming to terms with his infamous past and uncertain future.
2195,s2196,TV Show,Baywatch,,,United States,"May 23, 2019",1989,TV-PG,11 Seasons,"Action, Adventure, Classics",Remastered. Join the Baywatch lifeguards on their thrilling adventures filled with beautiful beaches and those iconic red swimsuits.
2196,s2197,TV Show,Beat Shazam,,,United States,"May 21, 2019",2017,TV-PG,1 Season,"Family, Game Shows, Music","Grammy-, Golden Globe- and Academy Award-winning actor and musician Jamie Foxx (“Ray,” “Django Unchained”) is set to host BEAT SHAZAM, a unique and interactive game show in which teams of two race against the clock and each other as they attempt to identify the biggest hit songs of all time. In the end, the team with the highest score will outlast the competition and go against Shazam, the world’s most popular song identification app, for the chance to win a cash prize. Executive-produced by Mark Burnett (“Survivor,” “The Voice”) and Jeff Apploff (“Don’t Forget the Lyrics!”), the straight-to-series order is scheduled to premiere in Summer 2017 on FOX. Foxx also will serve as an executive producer."
2199,s2200,TV Show,Counting On,,,United States,"May 15, 2019",2015,TV-PG,2 Seasons,"Documentaries, Reality",Jill and Jessa: Counting On follows the lives Jill Dillard and Jessa Seewald as they navigate adulthood and the changes that come with it.
2223,s2224,TV Show,Superstructures: Engineering Marvels,,,United States,"April 16, 2019",2019,TV-PG,1 Season,"Documentaries, Science & Technology",An exploration of engineering marvels.
2224,s2225,TV Show,Barefoot Contessa,,,United States,"April 15, 2019",2002,TV-G,1 Season,Cooking & Food,"Ina Garten knows how to entertain with simplicity, style and fun. Visit with Ina at home in the sumptuous Hamptons of New York to discover her shortcuts and recipes."
2234,s2235,Movie,Law of the Lawless,,,United States,"April 1, 2019",1964,TV-PG,87 min,"Action, Adventure","In Kansas during the 1880's, Clem Rogers known as the ""hanging judge"" arrives to try the son of the town's most influential man for murder. He refuses a bribe and is framed for a set-up crime."
2243,s2244,TV Show,Mental Samurai,,,United States,"March 20, 2019",2019,TV-PG,1 Season,"Game Shows, Reality","Rob Lowe hosts this mental obstacle course that sees contestants battling the boundaries of their minds to answer questions accurately with speed and precision. Not only does the course test their acumen in categories of knowledge, memory, puzzles and sequencing, but players must also contend with being physically transported around the set at high speeds in a specially designed capsule capable of rotating 360 degrees. People from all walks of life compete – underdogs triumph – in the game that anyone can play, but almost no one can win."
2250,s2251,TV Show,MasterChef Junior,,,United States,"March 13, 2019",2013,TV-PG,7 Seasons,"Cooking & Food, Family, Reality",Kids between the ages of 8 and 13 compete in a series of challenges and cook-offs.
2262,s2263,Movie,Three Identical Strangers,,,"United Kingdom, United States","February 26, 2019",2018,PG-13,120 min,"Documentaries, Drama, History",Identical triplets become separated at birth and adopted by three different families.
2276,s2277,Movie,Dog Days,,,United States,"February 4, 2019",2018,PG,113 min,"Comedy, Romance","Dog Days is a hilarious and heartfelt comedy that follows the lives of multiple dog owners and their beloved fluffy pals around Los Angeles. When these human and canines’ paths start to intertwine, their lives begin changing in ways they never expected."
2277,s2278,TV Show,The Bob Newhart Show,,,United States,"February 4, 2019",1972,TV-G,6 Seasons,"Classics, Comedy, Family","Bob Newhart is Dr. Robert Hartley, a Chicago psychologist living with his schoolteacher wife Emily."
2300,s2301,TV Show,Ally McBeal,,,United States,"January 1, 2019",1997,TV-PG,5 Seasons,"Classics, Comedy, Drama",A quirky series about a wistfully idealistic – if perennially insecure – lawyer and her chaotic life at a Boston firm.
2318,s2319,TV Show,Mighty Magiswords,,,United States,"December 24, 2018",2015,TV-Y7,2 Seasons,"Adventure, Cartoons, Comedy","Prohyas and Vambre, the brother and sister team of Warriors for Hire, are always up for a quest. But they never know what quest will drop in their laps! Giant pigs, giant spiders, or giant ancient dinosaurs, they can handle whatever giant quest you want; but not without their trusted collection of Magiswords."
2325,s2326,Movie,Hearts Beat Loud,,,United States,"December 19, 2018",2018,PG-13,97 min,"Comedy, Drama, Music","In Red Hook, Brooklyn, a father and daughter become an unlikely songwriting duo in the last summer before she leaves for college."
2330,s2331,TV Show,White Collar,,,United States,"December 17, 2018",2009,TV-PG,6 Seasons,"Crime, Drama","White Collar is about the unlikely partnership of a con artist and an FBI agent who have been playing cat and mouse for years. Neal Caffrey (Matt Bomer), a charming criminal mastermind, is finally caught by his nemesis, FBI Agent Peter Burke (Tim DeKay.)"
