,show_id,type,title,director,cast,country,date_added,release_year,rating,duration,listed_in,description
1059,s1060,TV Show,WWE NXT,,,United States,"January 7, 2021",2010,TV-PG,8 Seasons,Sports,The future is here. WWE’s hottest up and coming Superstars compete to prove they have what it takes.
1066,s1067,TV Show,Call Me Kat,,,"United Kingdom, United States","January 4, 2021",2021,TV-PG,1 Season,"Comedy, Sitcom","In an effort to prove to her mother – and society – that it's possible to be single at 39 and still be happy, Kat spends her entire savings to open a cat café in Louisville, Ky."
1070,s1071,Movie,Diary of a Wimpy Kid,,,"United States, United Kingdom","January 1, 2021",2010,PG,93 min,"Comedy, Family, Kids",A sixth grader attempts to find his place in the gawky adolescent world of junior high in this family film.
1074,s1075,Movie,Footloose,,,United States,"January 1, 2021",1984,PG,107 min,"Classics, Drama, Music",An urban teenager who moves to a small town dominated by a fundamentalist preacher wages an ambitious war against adult repression.
1076,s1077,Movie,How Do You Know,,,United States,"January 1, 2021",2010,PG-13,121 min,"Comedy, Drama, Romance","In this love triangle comedy, a white collar executive and professional baseball player are each vying for the affections of the same woman."
1079,s1080,Movie,Shrek,,,"United States, Japan","January 1, 2021",2001,TV-PG,120 min,"Action, Adventure, Cartoons","Once upon a time, in a far away swamp, there lived an ornery ogre named Shrek whose precious solitude is suddenly shattered by an invasion of annoying fairy tale characters."
1084,s1085,Movie,Where Hope Grows,,,United States,"January 1, 2021",2015,PG-13,98 min,"Drama, Family","A self-destructive former pro baseball player's faith in God is restored when he meets Produce, an inspirational man with Down syndrome"
1091,s1092,TV Show,The Masked Dancer,,,United States,"December 28, 2020",2020,TV-PG,1 Season,"Lifestyle & Culture, Reality","Hosted by comic Craig Robinson, with panelists Ken Jeong, Paula Abdul, Brian Austin Green and Ashley Tisdale, ""The Masked Dancer"" is a top-secret dance competition in which celebrities shake their tail feathers while covered from head to toe in elaborate costumes and face masks, leaving audiences to guess their identities. Costumed celebrities are joined on stage by masked partners and back-up dancers as they perform a series of dances together, spanning from hip-hop to salsa, jazz to tap dancing and more. When it comes to dance styles, the sky is the limit. Each week, a series of clues is sprinkled throughout packages, costumes and routines, leading the panelists one step closer to figuring out which famous faces are behind the masks."
1125,s1126,Movie,Valley Girl,,,United States,"December 7, 2020",2020,PG-13,103 min,Romance,A valley girl and a punk rocker from the city defy their parents and friends to stay together.
1128,s1129,Movie,The Secret Garden,,,"United Kingdom, France, United States, China","December 6, 2020",2020,PG,100 min,"Drama, Family, Science Fiction","A new take on the beloved classic novel, a young orphan girl who, after being sent to live with her uncle, discovers a magical garden on the grounds of his estate."
1141,s1142,Movie,Angels & Demons,,,"United States, Italy","December 1, 2020",2009,PG-13,139 min,"Mystery, Thriller","In Ron Howard's thrilling follow-up to The Da Vinci Code, expert symbologist Robert Langdon (Tom Hanks) follows ancient clues on a heart-racing hunt through Rome to find the four Cardinals kidnapped by the deadly secret society, the Illuminati."
1143,s1144,TV Show,Future-Worm!,,,United States,"December 1, 2020",2016,TV-Y7,1 Season,"Adventure, Kids, Science Fiction","Follow Danny and Future-Worm! while they navigate through space, time and study hall, embarking on adventures and spontaneously making up new ones with the help of their time machine lunch box."
1144,s1145,TV Show,Kick Buttowski: Suburban Daredevil,,,United States,"December 1, 2020",2011,TV-Y7,2 Seasons,"Adventure, Cartoons, Kids","Kick Buttowski is an extraordinary kid determined to become the worlds greatest daredevil. Small in stature, but big in heart, Kick takes on every stunt with unwavering enthusiasm."
1146,s1147,TV Show,Pickle and Peanut,,,United States,"December 1, 2020",2015,TV-Y7,2 Seasons,"Comedy, Kids",Two unlikely friends – an emotional pickle and a freewheeling peanut – have exciting adventures.
1150,s1151,TV Show,Wander Over Yonder,,,"United States, Canada, Ireland","December 1, 2020",2015,TV-Y7,2 Seasons,"Adventure, Comedy, Kids","Best friends, eternally-optimistic intergalactic traveler and constant do-gooder Wander and his quick-tempered but loyal steed Sylvia, travel through the cosmos happening upon one freewheeling adventure after another, making new friends (and foes) all while battling numerous forces of evil."
1151,s1152,TV Show,Zeke and Luther,,,United States,"December 1, 2020",2009,TV-Y7,3 Seasons,"Comedy, Family, Kids","Best friends Zeke and Luther have set their sights on becoming world-famous skateboarders. Together they attempt to master the coolest tricks and enter the biggest competitions. Between skating and summer school, there’s also donut deliveries, girls, and a pair of Tony Hawk’s boxers! Zeke and Luther are determined to be the best skateboarders in Pacific Terrace, no matter what obstacles stand in their way!"
1156,s1157,Movie,Happiest Season,,,"United States, Canada","November 25, 2020",2020,PG-13,102 min,"Comedy, Romance",A woman learns that her girlfriend hasn't come out to her conservative parents.
1163,s1164,TV Show,Animaniacs,,,United States,"November 20, 2020",2020,TV-G,1 Season,"Comedy, Kids","They’re back! The Warner brothers, Yakko and Wakko, and the Warner sister Dot, have a great time wreaking havoc and mayhem in the lives of everyone they meet. After returning to their beloved home, the Warner Bros. water tower, the siblings waste no time in causing chaos and comic confusion as they run loose through the studio, turning the world into their personal playground. Joining Yakko, Wakko and Dot, fan-favorite characters Pinky and the Brain also return to continue their quest for world domination."
1164,s1165,Movie,Run.,,,"United States, Canada","November 20, 2020",2020,PG-13,89 min,"Drama, Horror, Thriller","There’s something unnatural about the relationship between Chloe (Kiera Allen) and her mom, Diane (Sarah Paulson). Diane has raised her daughter in isolation, controlling every move since birth, and there are secrets that Chloe's only starting to grasp."
1165,s1166,Movie,Tesla,,,United States,"November 20, 2020",2020,PG-13,102 min,"Drama, History","Visionary inventor Nikola Tesla fights an uphill battle to bring his revolutionary electrical system to fruition, then faces thornier challenges with his new system for worldwide wireless energy."
1180,s1181,Movie,Roller Dreams,,,"United States, Australia","November 15, 2020",2017,PG,80 min,"Black Stories, Documentaries","It's 1984 and Venice Beach, CA, is at the epicenter of a pop culture explosion. Young people of color seeking refuge from the turmoil of inner city life flock to the eclectic ocean community to create a brand new phenomenon: roller dancing!"
1188,s1189,TV Show,The Reagans,,,United States,"November 15, 2020",2020,TV-PG,1 Season,Documentaries,Examining the highs and lows of President Ronald Reagan's time in the Oval Office.
1189,s1190,Movie,ULAM: Main Dish,,,United States,"November 15, 2020",2018,PG,80 min,Documentaries,"In this delicious documentary, Filipino-American filmmaker Alexandra Cuerdo answers this question – and follows the rise of the Filipino food movement via the chefs crossing over to the center of the American table."
1243,s1244,TV Show,Christmas Cookie Challenge,,,United States,"November 1, 2020",2017,TV-G,1 Season,"Cooking & Food, Lifestyle & Culture, Reality","Flour will cloud the air as a festive yet furious battle between bakers to determine the best cookie baker in the country. Five bakers' holiday treats are judged in three rounds of competition to determine which delectable treat will be the one to take home the prize for best treat. Each round of the competition focuses on a different theme, examples could be Christmas past and future, 3D art and ornaments. Judged on taste and creativity only one baker can take home the $10,000 prize."
1247,s1248,Movie,Elf,,,United States,"November 1, 2020",2003,PG,97 min,"Comedy, Family, Kids","One Christmas Eve a long time ago, a baby crawled into Santa's bag of toys... Raised as an elf, Buddy (Will Ferrell) grows into an adult three times larger than the biggest elf – and realizes that he will never truly fit in at the North Pole."
1248,s1249,Movie,Firewalker,,,United States,"November 1, 2020",1986,PG,105 min,"Action, Adventure, Comedy",They need a new plan! Two adventurers meet up with a beautiful woman who claims to know where to find a lost city filled gold - what could go wrong? A comic action-adventure!
1255,s1256,Movie,Never Been Kissed,,,United States,"November 1, 2020",1999,PG-13,108 min,"Comedy, Romance","Aspiring reporter Drew Barrymore goes undercover as a high schooler, only to relive the horror of being unpopular again."
1256,s1257,Movie,Paws P.I.,,,United States,"November 1, 2020",2018,PG,86 min,"Comedy, Family, Kids","Jon Lovitz highlights this hilarious family action-comedy as Jackson, a loveable mutt who helps his pal Peter battle bumbling bad guys to save an animal clinic."
1271,s1272,TV Show,American Housewife,,,United States,"October 29, 2020",2016,TV-PG,5 Seasons,"Comedy, Family, Sitcom","A confident, unapologetic wife and mother of three, raises her flawed family in the wealthy town of Westport, Connecticut, filled with ""perfect"" mommies and their ""perfect"" offspring."
1282,s1283,TV Show,Struggle Meals,,,United States,"October 27, 2020",2018,TV-G,3 Seasons,"Cooking & Food, Lifestyle & Culture","The struggle is real, but it doesn’t mean your food has to suffer. Chef Frankie Celenza shows you how to make delicious meals for under $2 a plate."
1288,s1289,TV Show,American Pickers,,,United States,"October 23, 2020",2010,TV-PG,2 Seasons,"Documentaries, Family, Reality","American Pickers follows Mike Wolfe and Frank Fritz as they travel the country searching for American treasures. While hitting the back roads from coast to coast, they meet quirky characters with amazing stories and forgotten relics hidden in their junkyards, basements, garages and barns."
1301,s1302,TV Show,Storage Wars,,,United States,"October 23, 2020",2010,TV-PG,1 Season,"Lifestyle & Culture, Reality","A&E presents the new original real-life series “Storage Wars,” which follows four professional buyers and their teams as they scour repossessed storage units in search of hidden treasure. Part gamblers, part detectives, these seasoned veterans have found everything from coffins to the world’s most valuable comic book collection, paying as little as ten dollars for items valued in the millions."
1309,s1310,TV Show,The Voice,,,United States,"October 20, 2020",2011,TV-PG,1 Season,"Family, Music, Reality","Four famous musician coaches will each select singers to mentor into artists during the blind auditions. Once they have their teams, the star coaches will bring in their personal songwriters, producers, and high-powered friends to help their teams evolve. Ultimately, America will decide which singer will be worthy of the grand prize."
1338,s1339,TV Show,Black-ish,,,United States,"October 5, 2020",2014,TV-PG,7 Seasons,"Black Stories, Comedy, Family","Andre 'Dre' Johnson has a great job, a beautiful wife, Rainbow, five kids, and a colonial home in the 'burbs. But has success brought too much assimilation for this black family?"
1349,s1350,TV Show,Bizarre Foods With Andrew Zimmern,,,United States,"October 1, 2020",2006,TV-PG,5 Seasons,"Cooking & Food, Family, Lifestyle & Culture","Andrew Zimmern is on a quest to find the world's most unique tastes on Bizarre Foods. As a chef and foodie, Andrew knows that one man's poison is another man's delicacy, but he isn't afraid to poke a little fun at the local fare or himself."
1364,s1365,Movie,Spider-Man 3,,,United States,"October 1, 2020",2007,PG-13,135 min,"Action, Adventure, Family","A strange black entity from another world bonds with Peter Parker and causes inner turmoil as he contends with new villains, temptations, and revenge."
1368,s1369,Movie,The Express,,,"United States, Germany","October 1, 2020",2008,PG,130 min,Drama,"The inspiring story of Ernie 'The Elmira Express' Davis, the first African American to win the Heisman Trophy."
1393,s1394,Movie,Buttons: A Christmas Tale,,,United States,"September 18, 2020",2018,PG,88 min,"Drama, Family, Kids","With a little help from their guardian angels, two orphan girls discover miracles really can happen."
1417,s1418,Movie,I Feel Pretty,,,"China, United States","September 1, 2020",2018,PG-13,111 min,Comedy,A woman wakes up from a fall believing she is the prettiest woman on earth.
1424,s1425,Movie,Trolls World Tour,,,United States,"September 1, 2020",2020,PG,91 min,"Action, Adventure, Comedy","When the kingdom is invaded by Rock Trolls, Queen Poppy (Anna Kendrick) and Branch (Justin Timberlake) embark on an epic quest to find the harmony that will save them all."
1434,s1435,TV Show,ThunderCats (1985),,,United States,"August 20, 2020",1985,TV-Y7,2 Seasons,"Action, Adventure, Cartoons","From beyond any known galaxy, bringing with them the laws and ideals of their green planet, Thundera, come the ThunderCats!"
1435,s1436,TV Show,ThunderCats (2011),,,"United States, Japan","August 20, 2020",2011,TV-PG,1 Season,"Action, Kids","ThunderCats, ho! Warner Bros. Animation (WBA) is reimagining the 1980s animated action classic in an all-new animated series combining swords and science and boasting ferocious battles with the highest of stakes."
1439,s1440,TV Show,Christina on the Coast,,,United States,"August 15, 2020",2019,TV-G,2 Seasons,"Lifestyle & Culture, Reality",Real estate and flipping expert Christina Anstead helps clients transform their outdated properties into high-end homes in Southern California. She also begins a personal journey as she looks for a new home for her family.
1443,s1444,Movie,Bernie the Dolphin 2,,,"Canada, United States","August 14, 2020",2019,G,99 min,"Comedy, Kids","The kids are thrilled that Bernie has come back. But so has their old enemy Winston, who's about to kidnap the talented dolphin. Kevin and Holly must rescue their splashy friend before it's too late."
1454,s1455,Movie,Slay the Dragon,,,United States,"August 6, 2020",2019,PG-13,104 min,"Black Stories, Documentaries",Activists work to rid gerrymandering from America's election process.
1455,s1456,Movie,The Peanut Butter Falcon,,,United States,"August 6, 2020",2019,PG-13,97 min,"Action, Adventure, Comedy","Shia LaBeouf, Dakota Johnson, and Zack Gottsagen star in ""a modern-day Mark Twain fable that will melt your heart"" (Flickering Myth)."
1456,s1457,TV Show,The Kids Are Alright,,,United States,"August 5, 2020",2018,TV-PG,1 Season,"Comedy, Sitcom","Set in the 1970s, this ensemble comedy follows a traditional Irish-Catholic family, the Clearys, as they navigate big and small changes during one of America’s most turbulent decades. In a working-class neighborhood outside Los Angeles, Mike and Peggy raise eight boisterous boys who live out their days with little supervision. The household is turned upside down as the times are changing and this family will never be the same. There are 10 people, three bedrooms, one bathroom and everyone in it for themselves."
1457,s1458,Movie,Dora and the Lost City of Gold,,,"United States, Mexico, Australia","August 3, 2020",2019,PG,102 min,"Adventure, Comedy, Kids","Having spent most of her life exploring the jungle, nothing could prepare Dora for her most dangerous adventure yet – high school. Accompanied by a ragtag group of teens and Boots the monkey, Dora embarks on a quest to save her parents while trying to solve the seemingly impossible mystery behind a lost Incan civilization."
1463,s1464,Movie,City Slickers,,,United States,"August 1, 2020",1991,PG-13,114 min,Comedy,An unhappy Manhattan yuppie is roped into a cattle drive in the southwest.
1472,s1473,Movie,Rustlers' Rhapsody,,,"United States, Spain","August 1, 2020",1985,PG,89 min,"Action, Adventure, Comedy","Rex O'Herlihan, The Singing Cowboy, finds himself in a cliché town where an evil cattle baron and some new cowboys conspire to force sheep ranchers out of their valley."
1475,s1476,TV Show,Teen Titans Go!,,,United States,"August 1, 2020",2015,TV-PG,5 Seasons,"Action, Adventure, Kids","From Warner Bros. Animation, these teen titans are on the go! Right after they make a sandwich or play some video games. Wait, there's laundry to do? (""Not it!"") After that, they'll definitely go fight some crime. Maybe. Don't miss the return of Robin, Starfire, Raven, Beast Boy and Cyborg - teen super heroes who are totally unsupervised!"
1477,s1478,Movie,Ultraviolet,,,United States,"August 1, 2020",2006,PG-13,87 min,"Action, Adventure, Drama","Milla Jovovich, Cameron Bright, Nick Chinlund and William Fichtner star in this story of a woman caught in a futuristic civil war between the government and a subculture of disease modified humans in whom speed, strength and intelligence are magnified."
1490,s1491,Movie,Shark vs. Whale,,,United States,"July 29, 2020",2020,TV-PG,,"Documentaries, Science & Technology",A drone films a humpback whale being strategically drowned by a great white shark; marine biologist Ryan Johnson explores how and why great white sharks become whale killers.
1504,s1505,Movie,Sharkcano,,,United States,"July 22, 2020",2020,TV-PG,,"Documentaries, Science & Technology",Shark scientist Dr. Michael Heithaus embarks on a mission to reveal the mysterious connection between sharks and volcanoes.
1531,s1532,Movie,I Am Not Your Negro,,,"Switzerland, France, Belgium, United States","July 3, 2020",2016,PG-13,94 min,"Black Stories, Documentaries","In 1979, James Baldwin wrote a letter to his literary agent describing his next project, ""Remember This House."" The book was to be a revolutionary, personal account of the lives and assassinations of three of his close friends: Medgar Evers, Malcolm X and Martin Luther King, Jr. At the time of Baldwin's death in 1987, he left behind only 30 completed pages of this manuscript. Filmmaker Raoul Peck envisions the book James Baldwin never finished."
1546,s1547,TV Show,Buddy vs. Duff,,,United States,"July 1, 2020",2019,TV-PG,1 Season,"Cooking & Food, Lifestyle & Culture, Reality","Buddy Valastro and Duff Goldman compete in a series of bake-offs that test their dessert skills. The judges will crown one winner, putting an end to the greatest feud in baking history."
1556,s1557,Movie,Rebel in the Rye,,,United States,"July 1, 2020",2017,PG-13,109 min,"Drama, History",A young J.D. Salinger struggles to find his voice in his life.
1558,s1559,TV Show,The American Farm,,,United States,"July 1, 2020",2019,TV-PG,1 Season,"Documentaries, Reality, Science & Technology","The American Farm puts viewers on the front lines of the fight to go from seed to stalk, and from farm to fork. It's an honest, true tale of risk and reward, hard work, science, and grit."
1560,s1561,TV Show,The Day I Picked My Parents,,,United States,"July 1, 2020",2019,TV-PG,1 Season,"Documentaries, Reality",Ten foster children who are part of a revolutionary program operated by the nonprofit organization Kidsave search to find their forever home.
1561,s1562,TV Show,The Grill Dads,,,United States,"July 1, 2020",2017,TV-G,1 Season,"Cooking & Food, Lifestyle & Culture, Reality","Hit the road with Mark and Fey, BFF dads with a combined love of all things grilled, fried, creative and downright flavorful. They'll showcase some of the most-epic bites to leave you wanting more – and perhaps serve up a few dad jokes while they're at it."
1563,s1564,TV Show,The Strongest Man in History,,,United States,"July 1, 2020",2019,TV-PG,1 Season,"Documentaries, Reality","HISTORY’s new series “The Strongest Man In History,” will send four of the world’s leading strongmen; – Brian Shaw, Eddie Hall, Robert Oberst and Nick Best – on a journey across the world in an attempt to break long-standing records of historic strength."
1566,s1567,TV Show,Welcome to Plathville,,,United States,"July 1, 2020",2019,TV-PG,1 Season,Reality,"The Plaths are a strikingly blonde, blue-eyed Quiverfull family with 9 children in Southeastern Georgia, who are very passionate about traditional roles, their courtship rituals, music, God, and domestic life."
1583,s1584,TV Show,Sweet Home Sextuplets,,,United States,"June 17, 2020",2018,TV-PG,1 Season,Reality,Eric and Courtney Waldrop navigate a high-risk sextuplet pregnancy and delivery while raising three older sons.
1586,s1587,TV Show,George to the Rescue,,,United States,"June 15, 2020",2010,TV-G,1 Season,Lifestyle & Culture,George Oliphant comes to the aid of homeowners across the country with renovation and redesign.
1588,s1589,Movie,Pan,,,"United States, United Kingdom, Australia","June 14, 2020",2015,PG,112 min,"Action, Adventure, Family",Hugh Jackman stars in this magical adaptation of 'Peter Pan' that finds Peter up against devious pirate Blackbeard.
1597,s1598,Movie,A Beautiful Planet,,,United States,"June 11, 2020",2016,G,46 min,"Documentaries, Kids","A Beautiful Planet is a breathtaking portrait of Earth from space. Made in cooperation with NASA, the film features stunning footage of our magnificent blue planet – and the effects humanity has had on it over time."
1603,s1604,Movie,Journey to the South Pacific,,,United States,"June 11, 2020",2013,G,40 min,"Documentaries, Kids","Jawi, a boy living on a tropical island in West Papua, encounters whale sharks, sea turtles and other creatures of the sea."
1604,s1605,Movie,Pandas,,,United States,"June 11, 2020",2018,G,42 min,"Documentaries, Kids","Join narrator Kristen Bell in Pandas, a heartwarming story about the adventures of Qian Qian, a captive-born giant panda cub who's destined for life in the wild."
1611,s1612,TV Show,Where's Waldo?,,,"United States, United Kingdom","June 7, 2020",2019,TV-Y,1 Season,"Action, Adventure, Family","Kid adventurers Waldo and Wenda are earning their stripes as junior members of an international travel society; but to complete their missions, these young Wanderers must face a rival globetrotter who uses magic to cause trouble all over the world."
1627,s1628,Movie,Happily N'Ever After,,,"United States, Germany, Canada, United Kingdom","June 1, 2020",2007,PG,87 min,"Action, Adventure, Comedy","When Cinderella's fairytale life takes a radical turn for the worse, she sheds her damsel-in-distress trappings and fights back against her power-mad stepmother!"
1641,s1642,TV Show,Star vs. The Forces of Evil,,,United States,"May 27, 2020",2015,TV-Y7,4 Seasons,"Adventure, Cartoons, Kids","After a few bold skirmishes with other-worldly monsters, fun-loving magical teen princess Star Butterfly is sent by her Royal Parents to live with the Diaz family on Earth, bringing along her own unique interdimensional style to her new planet. With the Diaz's teenage son Marco by her side, this foreign exchange student from another dimension embarks on new adventures battling evil villains throughout the multiverse and in high school, all in an effort to protect her powerful magic wand which she is still figuring out how to use."
1642,s1643,TV Show,World of Dance,,,United States,"May 27, 2020",2017,TV-PG,1 Season,Reality,"Three expert celebrity dancers judge, guide and mentor the world's top dancing talent and troupes of all ages. The competitors showcase their skills, ranging in styles from hip-hop and contemporary to ballroom, Latin and more, bringing their passion to battle it out with the best of the best. Alongside the competition, the performers share their inspirations, challenges and personal backstories while building close connections not only with each other but also with the judges themselves. As the contest intensifies, the field of dancers narrows, and in the finale, finalists vie for a life-changing million-dollar prize."
1643,s1644,TV Show,Doc McStuffins,,,"United States, Ireland","May 26, 2020",2012,TV-Y,5 Seasons,"Black Stories, Cartoons, Kids","A magical animated series about a six-year-old girl, Doc McStuffins, who has the ability to talk to and heal toys and stuffed animals! With the help of her stuffed animal friends, Doc runs a clinic for toys out of her playhouse. The series emphasizes the importance of lending a helping hand, or paw, when people and toys need it most."
1644,s1645,TV Show,Gravity Falls,,,United States,"May 26, 2020",2012,TV-Y7,2 Seasons,"Cartoons, Comedy, Kids","Twin brother and sister Dipper and Mabel Pines are in for an unexpected adventure when they spend the summer with their great uncle in the mysterious town of Gravity Falls, Oregon. Upon their arrival, Dipper and Mabel's huckster great uncle, also known as Grunkle Stan, enlists the siblings' help in running The Mystery Shack, a fun tourist trap he owns that overcharges unsuspecting customers. Although Dipper and Mabel quickly discover The Mystery Shack itself is a hoax, they sense there is something strange about their new town and together they begin to unlock the secrets of Gravity Falls."
1645,s1646,Movie,I Still Believe,,,United States,"May 26, 2020",2020,PG,116 min,"Drama, Music, Romance",From the makers of I CAN ONLY IMAGINE comes the true life story of Christian music mega star Jeremy Camp. His remarkable journey of love and loss proves there is always hope in the midst of tragedy and that faith tested is the only faith worth sharing.
