,show_id,type,title,director,cast,country,date_added,release_year,rating,duration,listed_in,description
21,s22,TV Show,Hoarders,,,United States,"October 15, 2021",2009,TV-PG,7 Seasons,"Health & Wellness, Lifestyle & Culture, Reality",Each 60-minute episode of Hoarders is a fascinating look inside the lives of two different people whose inability to part with their belongings is so out of control that they are on the verge of a personal crisis.
27,s28,TV Show,Swamp People,,,United States,"October 15, 2021",2010,TV-PG,3 Seasons,"Documentaries, Reality","Deep in the heart of Louisiana lies America's largest swamp – a million miles of inhospitable bayous, marshes and wetlands where nature rules and humans struggle to tame it."
49,s50,TV Show,Shark Tank,,,United States,"October 9, 2021",2009,TV-PG,12 Seasons,Reality,"From Executive Producer Mark Burnett comes an inventive new reality series you can sink your teeth into. Budding entrepreneurs with big ideas can still make their dreams come true and ABC is about to give them the chance to make it happen. Each week a group of self-made millionaires from all corners of the business world take their own hard earned money and offer everyday people their one true shot at making their dreams a reality. Some will sink, some will swim and some will be eaten alive."
60,s61,TV Show,America's Funniest Home Videos,,,United States,"October 4, 2021",1981,TV-PG,2 Seasons,"Comedy, Family","From practical jokes to home improvement plans gone awry, to animal mishaps and just flat out strange behavior, this hilarious show on ABC pulls out all the stops to present everyday people caught on tape in their most embarrassing moments!"
93,s94,Movie,Escape from Alcatraz,,,United States,"October 1, 2021",1979,PG,112 min,"Action, Crime, Drama",Based on true events! A hardened convict engineers an elaborate plan to escape infamous Alcatraz Prison - a feat nobody had successfully accomplished before. Directed by Don Siegel (Dirty Harry).
97,s98,Movie,GoldenEye,,,"United Kingdom, United States","October 1, 2021",1995,PG-13,130 min,"Action, Adventure, Thriller","Bond is thrown right into the action before the title song with an eye-opening cliff dive onto a plane. Sporting his signature debonair attitude and pricey gadgets, Bond investigates the destruction of a Russian satellite base."
103,s104,Movie,License to Kill,,,"United Kingdom, Mexico, United States","October 1, 2021",1989,PG-13,133 min,"Action, Adventure","This 16th James Bond outing finds Agent 007 defying his superiors and operating without his infamous “license to kill” when he takes revenge upon a Colombian drug kingpin, after the guy maims Bond’s best friend/former CIA agent and kills his new bride."
105,s106,Movie,Lost In Space,,,United States,"October 1, 2021",1998,PG-13,130 min,"Action, Adventure, Science Fiction","A family of space colonists, their pilot and a diabolical stowaway scientist become hopelessly lost beyond the galaxy when their mission is sabotaged."
109,s110,Movie,My Best Friend's Wedding,,,United States,"October 1, 2021",1997,PG-13,105 min,"Comedy, Romance","When a successful food critic learns that her former boyfriend/best friend is getting married, she stops at nothing to clench her own happiness. Stars Julia Roberts, Dermot Mulroney and Cameron Diaz."
124,s125,Movie,Star Trek II: The Wrath of Khan,,,United States,"October 1, 2021",1982,PG,113 min,"Action, Adventure, Classics","Admiral James T. Kirk is still in charge of a space fleet, but from behind a desk. Dr. McCoy and Mr. Spock convince him to take on a mission which sounds simple, but with the mysterious Khan, things get a little tricky."
125,s126,Movie,Star Trek III: The Search for Spock,,,United States,"October 1, 2021",1984,PG,105 min,"Action, Adventure, Family","Admiral Kirk's defeat of Khan and the creation of the Genesis planet are empty victories. Spock is dead and McCoy is inexplicably being driven insane. Then a visit from Sarek, Spock's father, provides a startling revelation."
127,s128,Movie,Star Trek V: The Final Frontier,,,United States,"October 1, 2021",1989,PG,106 min,"Action, Adventure, Family","In this classic movie spin off from the TV series, Captain Kirk and his crew must deal with Spock's long-lost half-brother who hijacks the Enterprise for an obsessive search for God at the center of the galaxy. Stars William Shatner and Leonard Nimoy."
128,s129,Movie,Star Trek VI: The Undiscovered Country,,,United States,"October 1, 2021",1991,PG,110 min,"Action, Adventure, Family",The crews of the Enterprise and the Excelsior must stop a plot to prevent a peace treaty between the Klingon Empire and the Federation.
131,s132,Movie,Star Trek: Insurrection,,,United States,"October 1, 2021",1998,PG,103 min,"Action, Adventure, Family","When the crew of the Enterprise learn of the federation plot against the inhabitants of a unique planet, Capt. Picard begins an open rebellion."
133,s134,Movie,Star Trek: The Motion Picture,,,United States,"October 1, 2021",1979,PG,130 min,"Action, Adventure, Family","This first Star Trek film reunites the U.S.S. Enterprise's original crew. Capt. James T. Kirk now an admiral, and his crew must save humanity from an alien ship steadily approaching Earth and destroying everything in its path."
148,s149,Movie,The Saint,,,United States,"October 1, 2021",1997,PG-13,116 min,"Action, Adventure, Drama","Want someone to infiltrate a top-secret organiz ation or steal a scientific formula that could change the world? For the right price, The Saint's your man."
157,s158,Movie,Victor Frankenstein,,,"United Kingdom, Canada, United States","October 1, 2021",2015,PG-13,110 min,"Drama, Horror",The story of Frankenstein and his monster is brought to eye-popping new life in this lavish update with Daniel Radcliffe and James McAvoy.
176,s177,TV Show,The Great North,,,United States,"September 27, 2021",2021,TV-PG,2 Seasons,"Adult Animation, Comedy, Sitcom","Following the adventures of the Tobin family, as single dad Beef tries to keep his kids close."
178,s179,TV Show,The Simpsons,,,United States,"September 27, 2021",1989,TV-PG,2 Seasons,"Adult Animation, Comedy, Sitcom","This long-running animated comedy focuses on the eponymous family in the town of Springfield in an unnamed U.S. state. The head of the Simpson family, Homer, is not a typical family man. A nuclear-plant employee, he does his best to lead his family but often finds that they are leading him. The family includes loving, blue-haired matriarch Marge, troublemaking son Bart, overachieving daughter Lisa and baby Maggie. Other Springfield residents include the family's religious neighbor, Ned Flanders, family physician Dr. Hibbert, Moe the bartender and police chief Clancy Wiggum."
190,s191,TV Show,The Conners,,,United States,"September 23, 2021",2018,TV-PG,1 Season,"Comedy, Sitcom","After a sudden turn of events, the Conner family is forced to face the daily struggles of life in a way they never have before. This iconic family continues to demonstrate that laughter, conversation and love can overcome anything."
192,s193,TV Show,The Goldbergs,,,United States,"September 23, 2021",2013,TV-PG,9 Seasons,"Comedy, Family, Sitcom","The Goldbergs are a loving family like any other, just with a lot more yelling, but for geeky 11-year old Adam these were his wonder years and he faced them armed with a video camera to capture all the crazy."
193,s194,TV Show,The Masked Singer,,,United States,"September 23, 2021",2019,TV-PG,6 Seasons,"Comedy, Music, Reality","Based on an international hit, which already is a viral phenomenon with more than half a billion fans worldwide, and the No. 1 top-trending video of 2017 on YouTube, THE MASKED SINGER features celebrities facing off against one another with one major twist: each singer is shrouded from head to toe in an elaborate costume, complete with full face mask to conceal his or her identity."
203,s204,TV Show,To Tell the Truth,,,United States,"September 20, 2021",2016,TV-PG,1 Season,"Comedy, Reality","""To Tell the Truth"" is an anarchic and funny re-imagination of the beloved, game show of the same name. In each round, celebrities are presented with three people who all claim to be the same person with the same incredible talent, job or achievement. One is sworn to tell the truth while the others are not. The panel of celebrities has a chance to grill each participant before taking turns deciding who they think is telling the truth."
223,s224,Movie,"Love, Simon",,,United States,"September 15, 2021",2018,PG-13,110 min,"Comedy, Drama, LGBTQ+",A closeted gay teen deals with coming out to his family and friends in this charming.coming-of-age tale.
224,s225,Movie,Maze Runner: The Death Cure,,,United States,"September 15, 2021",2018,PG-13,144 min,"Action, Adventure, Science Fiction","Thomas leads his group of escaped Gladers on a dangerous mission to save their friends in the finale to the ""Maze Runner"" trilogy."
236,s237,TV Show,Holey Moley,,,United States,"September 10, 2021",2019,TV-PG,1 Season,"Game Shows, Reality","A mini-golf competition series, will showcase self-proclaimed mini-golf lovers from around the country as they compete head-to-head through an epic obstacle golf course. In each episode, 12 contestants will put their miniature golf – and physical – skills to the test and face off in never-before-seen challenges on a supersized miniature golf course."
248,s249,TV Show,Dish Nation,,,United States,"September 7, 2021",2013,TV-PG,1 Season,Comedy,The biggest names in radio host TV's funniest entertainment news show!
278,s279,Movie,Girls! Girls! Girls!,,,United States,"September 1, 2021",1962,PG,99 min,"Comedy, Music","Fishing boat captain, popular with the ladies, sings at night to earn enough to buy his own boat."
279,s280,Movie,Hoosiers,,,"United Kingdom, United States","September 1, 2021",1986,PG,115 min,"Drama, Sports",Gene Hackman stars as a basketball coach who guides a tiny Indiana high-school team to a state title in this sports classic.
290,s291,Movie,Phase IV,,,"United Kingdom, United States","September 1, 2021",1974,PG,83 min,"Horror, Science Fiction, Thriller",Ecological suspense tale about a strange biological imbalance creating super intelligent ants which attack a scientific installation in the Arizona desert.
310,s311,Movie,The X-Files: Fight the Future,,,United States,"September 1, 2021",1998,PG-13,122 min,"Horror, Science Fiction, Thriller",FBI agents Mulder and Scully probe events that may prove the existence of aliens on Earth. Based on the TV series.
377,s378,TV Show,Madagascar: A Little Wild,,,United States,"August 6, 2021",2020,TV-G,4 Seasons,"Adventure, Cartoons, Family","Wrapped up in the endearing humor and physical comedy that made the Madagascar movies so popular, Madagascar: A Little Wild is a CG, musical comedy series featuring Alex, Marty, Gloria and Melman as young residents of a rescue habitat in the Central Park Zoo. Like everybody who lands in New York, these kids have big dreams and big plans. The series celebrates being yourself, never giving up, and pursuing your dreams with abandon, no matter the size."
408,s409,Movie,Some Kind of Wonderful,,,United States,"August 1, 2021",1987,PG-13,95 min,"Comedy, Romance","A young tomboy, Watts (Mary Stuart Masterson), discovers that her feelings for her best friend, Keith (Eric Stoltz), run deeper than just friendship when he gets a date with Amanda (Lea Thompson), the most popular girl in school. Amanda's ex, Hardy (Craig Scheffer), who is from the rich section of town, is unable to let go of her, and plans to get back at Keith."
410,s411,Movie,The Final Girls,,,"United States, Canada","August 1, 2021",2015,PG-13,91 min,"Comedy, Horror",Max is transported into a 1980s horror film that starred her dead mother.
420,s421,Movie,Under the Tuscan Sun,,,"United States, Italy","August 1, 2021",2003,PG-13,113 min,"Comedy, Drama, Romance",A recently divorced San Francisco writer impulsively buys a villa during a trip to Italy and embarks on a life-changing adventure.
544,s545,Movie,Take Every Wave: The Life of Laird Hamilton,,,United States,"July 1, 2021",2017,PG,118 min,"Documentaries, Sports","Experience the white-knuckle thrill of big wave surfing through the eyes of Laird Hamilton, a living legend who conquers the world's mightiest tides."
557,s558,Movie,Tooth Fairy,,,"United States, Canada","July 1, 2021",2010,PG,102 min,"Comedy, Family, Kids",Dwayne Johnson is a hockey-playing hellion who turns into a tutu-wearing Tooth Fairy to atone for his bad behavior in this family film.
586,s587,TV Show,Cutthroat Kitchen,,,United States,"June 21, 2021",2013,TV-G,14 Seasons,"Cooking & Food, Family, Lifestyle & Culture","Chefs get $25,000 and chances to spend that money on helping themselves or sabotaging competitors."
591,s592,TV Show,Worst Cooks in America,,,United States,"June 21, 2021",2010,TV-G,2 Seasons,"Cooking & Food, Family, Lifestyle & Culture",Chefs Anne Burrel and Beau MacMillan coach twelve of the worst cooks in America to transform them into gourmands.
607,s608,TV Show,Duck Dynasty,,,United States,"June 15, 2021",2012,TV-PG,1 Season,"Documentaries, Reality","Meet the Robertsons, a Louisiana bayou family living the American dream. A mom-and-pop operation, the Duck Commander business has become a sporting empire by making top-of-the-line duck calls and decoys."
608,s609,TV Show,Forged in Fire,,,United States,"June 15, 2021",2015,TV-PG,3 Seasons,"Documentaries, History, Reality","Forged in Fire is a competition show pitting master weapon makers against each other. Each week, four of the best blade smiths in the country will come together to put both their skills and reputations on the line."
629,s630,TV Show,MasterChef,,,United States,"June 10, 2021",2010,TV-PG,11 Seasons,"Cooking & Food, Family, Lifestyle & Culture","A culinary competition series that searches for the best home cooks in America, and through a series of exciting elimination rounds, will turn one of them into a culinary master."
634,s635,TV Show,Lego Masters,,,United States,"June 9, 2021",2020,TV-G,2 Seasons,"Game Shows, Reality",Twelve teams of two compete against each other in ambitious brick-building challenges to be crowned the country's most talented amateur LEGO builders.
639,s640,TV Show,The Chase,,,United States,"June 7, 2021",2021,TV-PG,1 Season,"Game Shows, Reality","A heart-racing quiz show where three competitors face off against the Chaser, a ruthless quiz genius determined to stop them from winning cash prizes. Each episode is a fast-paced battle of brainpower, where contestants are challenged to think faster than they ever thought possible to answer up to 166 questions across all topics."
650,s651,TV Show,American Ninja Warrior,,,United States,"June 1, 2021",2012,TV-PG,1 Season,"Action, Adventure, Family","American competitors face the world's most difficult obstacle course in Japan for the chance to win $500,000."
654,s655,Movie,Fun in Acapulco,,,United States,"June 1, 2021",1963,PG,97 min,"Comedy, Music",Fun In Acapulco portrays Elvis as a sexy lifeguard by day who transforms himself into a popular entertainer at night by singing at a local Mexican resort.
668,s669,Movie,The Cookout,,,United States,"June 1, 2021",2004,PG-13,88 min,"Black Stories, Comedy, Drama","NBA draftee, Todd Anderson, throws an old-fashioned cookout in his new upscale neighborhood."
673,s674,Movie,Wayne's World 2,,,United States,"June 1, 2021",1993,PG-13,95 min,"Comedy, Music","The success of their TV show allows Wayne Campbell and Garth Algar to finally move out of their parents' homes, but now they have to figure out what to do with their lives."
685,s686,TV Show,Press Your Luck,,,United States,"May 27, 2021",2019,TV-PG,2 Seasons,"Game Shows, Reality",A game of wits as contestants avoid the WHAMMY.
798,s799,TV Show,ABC This Week,,,United States,"April 11, 2021",1933,TV-PG,4 Seasons,News,"This Week offers newsmaker interviews and panel debates on a wide range of topics, plus commentary."
799,s800,TV Show,ABC World News Tonight With David Muir,,,United States,"April 10, 2021",1953,TV-PG,2 Seasons,News,World News brings the latest information and analysis of major events from around the country and the world.
825,s826,TV Show,Caribbean Life,,,United States,"April 1, 2021",2014,TV-G,6 Seasons,"Family, Lifestyle & Culture, Reality",Searching for a new home and a new lifestyle in the Caribbean.
827,s828,TV Show,Chopped,,,United States,"April 1, 2021",2000,TV-G,17 Seasons,"Cooking & Food, Family, Lifestyle & Culture","Passion and expertise rule the kitchen on the fast-paced new series, Chopped. Hosted by Ted Allen (Food Detectives), the series challenges four up-and-coming chefs to turn a selection of everyday ingredients into an extraordinary three-course meal. After each course, a contestant gets ""chopped"" until the last man or woman left standing claims victory."
829,s830,TV Show,"Diners, Drive-Ins and Dives",,,United States,"April 1, 2021",2006,TV-G,8 Seasons,"Cooking & Food, Family, Lifestyle & Culture",Guy Fieri drives coast to coast sampling classic road food.
831,s832,TV Show,Guy's Grocery Games,,,United States,"April 1, 2021",2013,TV-G,10 Seasons,"Cooking & Food, Family, Lifestyle & Culture",Guy Fieri pits four talented chefs against one another in a grocery store cooking competition.
834,s835,TV Show,Say Yes to the Dress,,,United States,"April 1, 2021",2014,TV-PG,5 Seasons,"Family, Lifestyle & Culture, Reality",Say Yes to the Dress goes behind-the-scenes at Kleinfeld's bridal salon in New York and uncovers the hurdles every staff member faces to make each bride completely satisfied on what may be the single most important day of her life.
844,s845,TV Show,Unikitty,,,"United States, Denmark","April 1, 2021",2017,TV-Y7,3 Seasons,"Action, Adventure, Comedy","Cartoon Network is transporting viewers to a joyous kingdom full of sparkle matter, happy thoughts and the occasional rage-out in Unikitty!"
864,s865,TV Show,Catfish: The TV Show,,,United States,"March 20, 2021",2012,TV-PG,8 Seasons,"Documentaries, Reality, Teen",Catfish: The TV Show brings together couples who've interacted solely through LCD screens. Over the course of months they've supposedly fallen in love – but what will happen when they meet in real life for the first time?
959,s960,TV Show,Forged in Fire: Beat the Judges,,,United States,"February 15, 2021",2020,TV-PG,1 Season,Reality,"In each episode, the best bladesmiths from all over the country come to the forge for a once-in-a-lifetime opportunity, to square off against our renowned Forged in Fire Masters in the highest stakes forging competition yet!"
960,s961,TV Show,House Hunters,,,United States,"February 15, 2021",1999,TV-G,30 Seasons,"Family, Lifestyle & Culture, Reality","The pursuit of the perfect home involves big decisions. This series follows real buyers as they establish a budget, tour homes for sale, weigh pros and cons, and finally make an offer."
961,s962,TV Show,House Hunters International,,,United States,"February 15, 2021",2006,TV-G,22 Seasons,"Family, Lifestyle & Culture, Reality","This spinoff of the wildly popular HGTV House Hunters globe trots from Sao Paolo to Prague. Home hunters and their real estate agents check out all sorts of architectural styles and work through the idiosyncrasies of buying real estate in other countries. In any language, home buying is an emotional experience."
965,s966,TV Show,Pawn Stars,,,United States,"February 15, 2021",2009,TV-PG,2 Seasons,Reality,"""Pawn Stars"" follows three generations of the Harrison family as they assess the value of items coming in and out of their Gold & Silver Pawn Shop in Las Vegas, from the commonplace to the truly historic."
969,s970,TV Show,The Secret of Skinwalker Ranch,,,United States,"February 15, 2021",2020,TV-PG,1 Season,"Documentaries, Science Fiction","For the first time ever, HISTORY is gaining full, unprecedented access to one of the most infamous and secretive hotspots of paranormal and UFO-related activities on earth, Skinwalker Ranch."
985,s986,TV Show,Moesha,,,United States,"February 9, 2021",1996,TV-PG,6 Seasons,"Black Stories, Comedy, Sitcom","Navigating the twists and firsts of being a teen, Moesha juggles friendships, romance and the occasional drama while trying to keep her family together."
986,s987,TV Show,"Sister, Sister",,,United States,"February 9, 2021",1994,TV-G,6 Seasons,"Black Stories, Comedy, Sitcom",Tia Landry and Tamera Campbell are twins separated at birth who learn of each other's existence and come together as teenagers.
1012,s1013,TV Show,Mixed-ish,,,United States,"January 27, 2021",2019,TV-PG,2 Seasons,"Black Stories, Comedy, Sitcom","In this spinoff of the hit series black-ish, Rainbow Johnson recounts her experience growing up in a mixed-race family in the '80s, and the constant dilemmas they had to face over whether to assimilate or stay true to themselves. Bow's parents Paul and Alicia decide to move from a hippie commune to the suburbs to better provide for their family. As her parents struggle with the challenges of their new life, Bow and her siblings navigate a mainstream school in which they’re perceived as neither black nor white."
1015,s1016,TV Show,Freaks and Geeks,,,United States,"January 25, 2021",1999,TV-PG,1 Season,"Comedy, Drama","The universal experience of teenagehood as lived by the regular old freaks and geeks in a Michigan high school, circa 1980, is the subject of this wistful comedy-drama executive-produced by Emmy-winner Judd Apatow and series creator Paul Feig."
1024,s1025,TV Show,A Very Brady Renovation,,,United States,"January 20, 2021",2019,TV-G,1 Season,"Lifestyle & Culture, Reality","Jason Pickens visits The Brady Bunch cast members to learn what they're doing now. Then, from touring historic homes with Eve Plumb to exploring Branson, MO, with Barry Williams, he explores each cast member's passion project."
1026,s1027,TV Show,Gold Rush,,,United States,"January 20, 2021",2010,TV-PG,3 Seasons,Reality,"In the face of an economic meltdown, a group of men will risk everything to strike it rich mining for gold in the wilds of Alaska."
1028,s1029,TV Show,Property Brothers: Forever Home,,,United States,"January 20, 2021",2019,TV-G,1 Season,"Lifestyle & Culture, Reality",Drew and Jonathan Scott are on a mission to help couples transform their houses into homes where they can put down roots. The brothers unlock the full potential of each property and renovate to make dreams come true.
1030,s1031,TV Show,Rock the Block,,,United States,"January 20, 2021",2019,TV-PG,1 Season,"Lifestyle & Culture, Reality","Leanne Ford, Alison Victoria, Jasmine Roth and Mina Starsiak-Hawk each have a month to renovate a home. The designer who nets the highest appraisal gets bragging rights and a street named in her honor."
1042,s1043,TV Show,Unpolished,,,United States,"January 13, 2021",2019,TV-PG,2 Seasons,Reality,"Following the zany antics of a family-run salon on Long Island, including nail artist Lexi Martone and her sister Bria who co-own the place."
1044,s1045,TV Show,Last Man Standing,,,United States,"January 11, 2021",2011,TV-PG,9 Seasons,"Comedy, Family, Sitcom","Mike Baxter is a happily married father of three daughters who finds himself the odd man out as he tries to maintain his manliness in a home surrounded by women. Mike tries to escape all the female drama at home in the warm, manly embrace of his job at the Outdoor Man store, a sporting goods emporium where he is marketing director. He also revels in his Outdoor Man vlog, which he uses as a pulpit for his opinions – which often have nothing to do with the store's merchandise. When he's supposed to be selling mountain bikes or kayaks, he somehow ends up spouting off about the environment, health care, international politics or any other topic occupying his mind."
1045,s1046,Movie,Lights Out,,,United States,"January 11, 2021",2016,PG-13,81 min,"Horror, Thriller",A young woman and her step-brother are terrorized by a malevolent spirit that only appears when the lights go out.
1049,s1050,TV Show,WWE 205 Live,,,United States,"January 9, 2021",2016,TV-PG,6 Seasons,Sports,"The greatest performers from WWE's Cruiserweight division showcase their unparalleled abilities on WWE Network! Witness Buddy Murphy, Cedric Alexander, The Brian Kendrick, Kalisto, Gran Metalik, and many more world-class talents perform breathtaking feats of athleticism on 205 Live!"
1051,s1052,TV Show,Celebrity Wheel of Fortune,,,United States,"January 8, 2021",2021,TV-PG,1 Season,Game Shows,"""Celebrity Wheel of Fortune"" takes a new spin on the iconic game show ""Wheel of Fortune."" Hosted by pop culture legends Pat Sajak and Vanna White, ""Celebrity Wheel of Fortune"" welcomes celebrity contestants to spin the world's most famous wheel and solve word puzzles for a chance to win up to $1 million. All of the money won by the celebrity contestants goes to a charity of their choice."
1053,s1054,TV Show,Mr. Mayor,,,United States,"January 8, 2021",2021,TV-PG,1 Season,"Comedy, Sitcom","When retired Los Angeles businessman Neil Bremer decides to run for mayor of his beloved city, he surprises everyone and wins the seat. With great ideas and commitment to the community, he optimistically sets out to get to work shaking up City Hall. However, he quickly discovers navigating politics is not business as usual. There are opinions to be heard, ribbons to be cut and foods to be eaten – all in support of his fellow citizens. Luckily, he can rely on the know-how of his political-veteran deputy Arpi – whose savvy and ambition make her equal parts friend and foil – and the dedication of his offbeat staff to keep him on the right path, as well as some inspiration from his teenage daughter."
1058,s1059,TV Show,WWE Main Event,,,United States,"January 7, 2021",2012,TV-PG,8 Seasons,Sports,"Join us each week for WWE Main Event, as the Superstars of the Monday Night RAW roster battle it out."
